ML Catalog Number,Format,Common Name,Scientific Name,Background Species,Caption,Recordist,Date,Year,Month,Day,Time,Country,Country-State-County,State,County,Locality,Latitude,Longitude,Age/Sex,Behaviors,Playback,Captive,Collected,Specimen ID,Home Archive Catalog Number,Recorder,Microphone,Accessory,Partner Institution,eBird Checklist ID,Unconfirmed,Air Temp(°C),Water Temp(°C),Media notes,Observation Details,Parent Species,eBird Species Code,Taxon Category,Taxonomic Sort,Recordist 2,Average Community Rating,Number of Ratings,Asset Tags,Original Image Height,Original Image Width
645650736,Audio,Great Crested Flycatcher,Myiarchus crinitus,,,Robert Russo,5/16/25,2025,5,16,2000,United States,US-NC-047,North Carolina,Columbus,Lake Waccamaw,34.3005719,-78.5634191,,,Unspecified,FALSE,FALSE,,,,,,,S285587295,,,,,,Myiarchus crinitus,grcfly,Species,17334,,0,0,,,
645648823,Audio,Great Crested Flycatcher,Myiarchus crinitus,,,Robert Russo,5/31/25,2025,5,31,1000,United States,US-NC-013,North Carolina,Beaufort,Goose Creek SP,35.4710859,-76.9103909,,,Unspecified,FALSE,FALSE,,,,,,,S285579405,,,,,,Myiarchus crinitus,grcfly,Species,17334,,0,0,,,
639661291,Audio,Great Crested Flycatcher,Myiarchus crinitus,,,Ralph Erickson,7/29/25,2025,7,29,630,United States,US-NC-143,North Carolina,Perquimans,Perquimans County Community Center,36.170507,-76.445909,,,Unspecified,FALSE,FALSE,,,,,,,S263856522,,,,,,Myiarchus crinitus,grcfly,Species,17334,,0,0,,,
639660271,Audio,Great Crested Flycatcher,Myiarchus crinitus,,,Ralph Erickson,7/31/25,2025,7,31,658,United States,US-NC-041,North Carolina,Chowan,Woodard Road,36.0223911,-76.4751186,,,Unspecified,FALSE,FALSE,,,,,,,S264044579,,,,,,Myiarchus crinitus,grcfly,Species,17334,,0,0,,,
638804027,Audio,Great Crested Flycatcher,Myiarchus crinitus,,,Jeff Lewis,6/19/25,2025,6,19,654,United States,US-NC-189,North Carolina,Watauga,Moses H. Cone Memorial Park--Rich Mountain Rd.,36.1518997,-81.7053759,,,Unspecified,FALSE,FALSE,,,,,,,S252022347,,,,,,Myiarchus crinitus,grcfly,Species,17334,,1,1,,,
638449056,Audio,Great Crested Flycatcher,Myiarchus crinitus,,,Ralph Erickson,7/4/25,2025,7,4,625,United States,US-NC-151,North Carolina,Randolph,Center Cross Baptist Church,35.5201349,-79.8312742,,,Unspecified,FALSE,FALSE,,,,,,,S256816741,,,,,,Myiarchus crinitus,grcfly,Species,17334,,0,0,,,
638363644,Audio,Great Crested Flycatcher,Myiarchus crinitus,Poecile carolinensis -- Carolina Chickadee,,Karen Lebing,7/2/25,2025,7,2,653,United States,US-NC-055,North Carolina,Dare,Alligator River NWR--Creef Cut Wildlife Trail,35.8637577,-75.8607094,Adult – 1,Call,Unspecified,,,,,iPhone,,,,S256170134,,,,,,Myiarchus crinitus,grcfly,Species,17334,,0,0,,,
638330553,Audio,Great Crested Flycatcher,Myiarchus crinitus,,,Ralph Erickson,7/1/25,2025,7,1,911,United States,US-NC-181,North Carolina,Vance,Fox Pond Park,36.318334,-78.369954,,,Unspecified,FALSE,FALSE,,,,,,,S255992113,,,,,,Myiarchus crinitus,grcfly,Species,17334,,0,0,,,
637619629,Audio,Great Crested Flycatcher,Myiarchus crinitus,Vireo olivaceus -- Red-eyed Vireo,,Teresa Noel,6/14/25,2025,6,14,1405,United States,US-NC-135,North Carolina,Orange,Cane Creek Reservoir (Restricted Access),35.9493948,-79.2423098,,,Not Used,,,,,Google Pix 6 with Merlin,,,,S250413707,,,,,,Myiarchus crinitus,grcfly,Species,17334,,0,0,,,
637619155,Audio,Great Crested Flycatcher,Myiarchus crinitus,Vireo olivaceus -- Red-eyed Vireo,,Teresa Noel,6/14/25,2025,6,14,1405,United States,US-NC-135,North Carolina,Orange,Cane Creek Reservoir (Restricted Access),35.9493948,-79.2423098,,,Not Used,,,,,Google Pix 6 with Merlin,,,,S250413707,,,,,,Myiarchus crinitus,grcfly,Species,17334,,0,0,,,
637412508,Audio,Great Crested Flycatcher,Myiarchus crinitus,Baeolophus bicolor -- Tufted Titmouse,,A H,4/18/25,2025,4,18,848,United States,US-NC-135,North Carolina,Orange,Brumley Nature Preserve--South,36.031475,-79.05894,,,Unspecified,FALSE,FALSE,,,,,,,S249208491,,,,,,Myiarchus crinitus,grcfly,Species,17334,,3,1,,,
636939462,Audio,Great Crested Flycatcher,Myiarchus crinitus,,,david pennebaker,5/31/25,2025,5,31,700,United States,US-NC-063,North Carolina,Durham,Quail Roost,36.195636,-78.9064629,,,Unspecified,FALSE,FALSE,,,,,,,S245108587,,,,,,Myiarchus crinitus,grcfly,Species,17334,,0,0,,,
636689002,Audio,Great Crested Flycatcher,Myiarchus crinitus,,,Ralph Erickson,5/28/25,2025,5,28,1326,United States,US-NC-077,North Carolina,Granville,Butner Game Land--Brickhouse Rd. (Granville Co.),36.1078356,-78.8036483,,,Unspecified,FALSE,FALSE,,,,,,,S243959187,,,,,,Myiarchus crinitus,grcfly,Species,17334,,0,0,,,
636492935,Audio,Great Crested Flycatcher,Myiarchus crinitus,,,Ralph Erickson,5/23/25,2025,5,23,1333,United States,US-NC-049,North Carolina,Craven,Maple Cypress Boat Ramp,35.313567,-77.302906,,,Unspecified,FALSE,FALSE,,,,,,,S241718938,,,,,,Myiarchus crinitus,grcfly,Species,17334,,0,0,,,
636490921,Audio,Great Crested Flycatcher,Myiarchus crinitus,,,Ralph Erickson,5/24/25,2025,5,24,748,United States,US-NC-191,North Carolina,Wayne,Cliffs of the Neuse SP,35.235636,-77.890952,,,Unspecified,FALSE,FALSE,,,,,,,S242160627,,,,,,Myiarchus crinitus,grcfly,Species,17334,,0,0,,,
636260072,Audio,Great Crested Flycatcher,Myiarchus crinitus,,,Betty Thomas,5/21/25,2025,5,21,1936,United States,US-NC-119,North Carolina,Mecklenburg,Freedom Park,35.1893821,-80.8450413,,,Unspecified,FALSE,FALSE,,,,,,,S241070935,,,,,,Myiarchus crinitus,grcfly,Species,17334,,0,0,,,
636252772,Audio,Great Crested Flycatcher,Myiarchus crinitus,,,Ralph Erickson,5/20/25,2025,5,20,630,United States,US-NC-055,North Carolina,Dare,Bodie Island Lighthouse & Pond,35.819076,-75.562966,,,Unspecified,FALSE,FALSE,,,,,,,S240744194,,,,,,Myiarchus crinitus,grcfly,Species,17334,,0,0,,,
636162240,Audio,Great Crested Flycatcher,Myiarchus crinitus,,,Kent Fiala,5/20/25,2025,5,20,822,United States,US-NC-135,North Carolina,Orange,Borland Road (Home),36.0044975,-79.1378184,Male – 1,Call,Not Used,,,,,Samsung Galaxy S25+,,,,S240540865,,,,,,Myiarchus crinitus,grcfly,Species,17334,,4.5,2,,,
635936046,Audio,Great Crested Flycatcher,Myiarchus crinitus,,,Martin Wall,5/12/25,2025,5,12,457,United States,US-NC-133,North Carolina,Onslow,"Kellum SE - 28546, Jacksonville US-NC (34.7796,-77.3001)",34.779621,-77.300124,Adult Male – 1,Song,Not Used,,,,,iPhone 15,,,,S236928709,,,,,2 S,Myiarchus crinitus,grcfly,Species,17334,,0,0,,,
635896807,Audio,Great Crested Flycatcher,Myiarchus crinitus,,,Ralph Erickson,5/16/25,2025,5,16,722,United States,US-NC-127,North Carolina,Nash,Stoney Creek Enviro Park new parcel,35.9732389,-77.9801301,,,Unspecified,FALSE,FALSE,,,,,,,S238700734,,,,,,Myiarchus crinitus,grcfly,Species,17334,,0,0,,,
635819629,Audio,Great Crested Flycatcher,Myiarchus crinitus,,,Betty Thomas,5/15/25,2025,5,15,909,United States,US-NC-119,North Carolina,Mecklenburg,Freedom Park,35.1893821,-80.8450413,,,Unspecified,FALSE,FALSE,,,,,,,S238125787,,,,,,Myiarchus crinitus,grcfly,Species,17334,,0,0,,,
635769005,Audio,Great Crested Flycatcher,Myiarchus crinitus,,,Virginia Palumbo,5/8/25,2025,5,8,1506,United States,US-NC-135,North Carolina,Orange,Cedar Falls Park,35.9576122,-79.0331442,,,Unspecified,FALSE,FALSE,,,,,,,S234813792,,,,,,Myiarchus crinitus,grcfly,Species,17334,,0,0,,,
635747892,Audio,Great Crested Flycatcher,Myiarchus crinitus,,,Ralph Erickson,5/13/25,2025,5,13,1003,United States,US-NC-007,North Carolina,Anson,Pee Dee NWR--Wildlife Dr.,35.0604491,-80.0897528,,,Unspecified,FALSE,FALSE,,,,,,,S237523743,,,,,,Myiarchus crinitus,grcfly,Species,17334,,0,0,,,
635381840,Audio,Great Crested Flycatcher,Myiarchus crinitus,,,Ralph Erickson,5/9/25,2025,5,9,1015,United States,US-NC-111,North Carolina,McDowell,Lake James SP--Catawba River Area,35.7312852,-81.9030398,,,Unspecified,FALSE,FALSE,,,,,,,S235150190,,,,,,Myiarchus crinitus,grcfly,Species,17334,,0,0,,,
635301802,Audio,Great Crested Flycatcher,Myiarchus crinitus,,,Mackenzie Hall,5/4/25,2025,5,4,853,United States,US-NC-047,North Carolina,Columbus,Lake Waccamaw SP,34.2904101,-78.5098457,,,Unspecified,FALSE,FALSE,,,,,,,S233006982,,,,,,Myiarchus crinitus,grcfly,Species,17334,,2,1,,,
635164540,Audio,Great Crested Flycatcher,Myiarchus crinitus,,,Mark Montazer,5/6/25,2025,5,6,550,United States,US-NC-037,North Carolina,Chatham,SDR North & Beaver Pond (Private),35.7543493,-79.2078762,,,Unspecified,FALSE,FALSE,,,,,,,S233767875,,,,,I don't believe I've ever heard this exact vocalization before.,Myiarchus crinitus,grcfly,Species,17334,,3,1,,,
635138753,Audio,Great Crested Flycatcher,Myiarchus crinitus,Spizella passerina -- Chipping Sparrow,,Ava Kornfeld,5/5/25,2025,5,5,930,United States,US-NC-007,North Carolina,Anson,Pee Dee NWR--Wildlife Dr.,35.0604491,-80.0897528,,,Unspecified,FALSE,FALSE,,,,,,,S233512215,,,,,,Myiarchus crinitus,grcfly,Species,17334,,0,0,,,
635094251,Audio,Great Crested Flycatcher,Myiarchus crinitus,,,Paul Beerman,5/3/25,2025,5,3,612,United States,US-NC-067,North Carolina,Forsyth,Historic Bethabara Park--Lower Trails,36.1553406,-80.2995872,,,Unspecified,FALSE,FALSE,,,,,,,S232384229,,,,,,Myiarchus crinitus,grcfly,Species,17334,,0,0,,,
634711553,Audio,Great Crested Flycatcher,Myiarchus crinitus,,,Ralph Erickson,4/28/25,2025,4,28,705,United States,US-NC-197,North Carolina,Yadkin,4454 Shoals Road,36.2574175,-80.5171251,,,Unspecified,FALSE,FALSE,,,,,,,S230565527,,,,,,Myiarchus crinitus,grcfly,Species,17334,,0,0,,,
634526143,Audio,Great Crested Flycatcher,Myiarchus crinitus,Cyanocitta cristata -- Blue Jay,,John Koon,9/15/20,2020,9,15,857,United States,US-NC-021,North Carolina,Buncombe,Pearson Drive,35.6045911,-82.5687146,,Call,Unspecified,,,,,,,,,S73631769,,,,,,Myiarchus crinitus,grcfly,Species,17334,,3,1,,,
634288979,Audio,Great Crested Flycatcher,Myiarchus crinitus,,,Chuck Gehringer,4/22/25,2025,4,22,704,United States,US-NC-125,North Carolina,Moore,Bethesda’s road atlas block Southern pines SE,35.161801,-79.375336,,,Unspecified,FALSE,FALSE,,,,,,,S228172356,,,,,,Myiarchus crinitus,grcfly,Species,17334,,0,0,,,
633564147,Audio,Great Crested Flycatcher,Myiarchus crinitus,,,Ralph Erickson,4/11/25,2025,4,11,1302,United States,US-NC-103,North Carolina,Jones,Catfish Lake Road,34.881046,-77.169123,,,Unspecified,FALSE,FALSE,,,,,,,S224679953,,,,,,Myiarchus crinitus,grcfly,Species,17334,,0,0,,,
633494636,Audio,Great Crested Flycatcher,Myiarchus crinitus,,,Scott Walker,4/10/25,2025,4,10,1006,United States,US-NC-019,North Carolina,Brunswick,"11–99 Maritime Way, Bald Head Island US-NC",33.858487,-77.982682,,,Unspecified,FALSE,FALSE,,,,,,,S224313881,,,,,,Myiarchus crinitus,grcfly,Species,17334,,1,1,,,
633418618,Audio,Great Crested Flycatcher,Myiarchus crinitus,,,Steve Taylor,4/8/25,2025,4,8,1545,United States,US-NC-147,North Carolina,Pitt,Grimesland Ponds,35.5823568,-77.1699858,,,Unspecified,FALSE,FALSE,,,,,,,S223951138,,,,,"That's what Merlin Sound ID said.  I'm attaching the sound file, cleaned up in Audacity, and will leave it to better birders than me to argue with Merlin Sound ID!  Just let me know how I should correct it.",Myiarchus crinitus,grcfly,Species,17334,,5,1,,,
633405865,Audio,Great Crested Flycatcher,Myiarchus crinitus,,,William Warfel,4/8/25,2025,4,8,1117,United States,US-NC-051,North Carolina,Cumberland,"8839 Gip Road, Fayetteville, North Carolina, US (34.905, -78.664)",34.9053084,-78.6640791,,,Unspecified,FALSE,FALSE,,,,,,,S223896348,,,,,"Calling with his persistent ""wheep, wheep, wheep"" call.",Myiarchus crinitus,grcfly,Species,17334,,4,1,,,
633368961,Audio,Great Crested Flycatcher,Myiarchus crinitus,Cardinalis cardinalis -- Northern Cardinal; Cyanocitta cristata -- Blue Jay; Corvus brachyrhynchos -- American Crow; Thryothorus ludovicianus -- Carolina Wren; Spizella passerina -- Chipping Sparrow; Dryobates pubescens -- Downy Woodpecker; Poecile carolinensis -- Carolina Chickadee,,WS Barbour,4/7/25,2025,4,7,720,United States,US-NC-065,North Carolina,Edgecombe,Temperance Hall Rd near Corn Creek,35.8367417,-77.7436566,Unknown – 1,Call,Not Used,,,,,Iphone SE,N/A,,,S223782326,,,,,"Early bird. Calling repeatedly “kweeep, kweeep”. Recording attached",Myiarchus crinitus,grcfly,Species,17334,,3,1,,,
633359015,Audio,Great Crested Flycatcher,Myiarchus crinitus,,,Martin Wall,4/7/25,2025,4,7,1011,United States,US-NC-103,North Carolina,Jones,"28573, Pollocksville US-NC 35.00969, -77.25941",35.009691,-77.25941,,,Unspecified,FALSE,FALSE,,,,,,,S223742835,,,,,Single note calling,Myiarchus crinitus,grcfly,Species,17334,,4,1,,,
633355284,Audio,Great Crested Flycatcher,Myiarchus crinitus,,,Christine Stoughton Root,4/7/25,2025,4,7,950,United States,US-NC-103,North Carolina,Jones,"28573, Pollocksville US-NC 35.00915, -77.26097",35.009153,-77.260967,,,Unspecified,FALSE,FALSE,,,,,,,S223731901,,,,,Singe note call’s recording to follow,Myiarchus crinitus,grcfly,Species,17334,,3,1,,,
633343714,Audio,Great Crested Flycatcher,Myiarchus crinitus,,,Patty McQuillan,4/7/25,2025,4,7,700,United States,US-NC-183,North Carolina,Wake,Lake Lynn,35.8820127,-78.7001324,,,Unspecified,FALSE,FALSE,,,,,,,S223675550,,,,,Was in nearby tree along paved path from the community center halfway to boardwalks.,Myiarchus crinitus,grcfly,Species,17334,,0,0,,,
633297883,Audio,Great Crested Flycatcher,Myiarchus crinitus,,,Walker Mabe,4/5/25,2025,4,5,855,United States,US-NC-183,North Carolina,Wake,Lake Raleigh,35.7667941,-78.6778808,,,Unspecified,FALSE,FALSE,,,,,,,S223516010,,,,,,Myiarchus crinitus,grcfly,Species,17334,,4,1,,,
633239417,Audio,Great Crested Flycatcher,Myiarchus crinitus,,,Payton DeMay,4/5/25,2025,4,5,1138,United States,US-NC-183,North Carolina,Wake,Wilkerson Nature Preserve Park,35.921577,-78.598713,,,Unspecified,FALSE,FALSE,,,phone,Rode videomicGO,,,S223170097,,,,"Not the best quality, but present on the spectrogram at seconds 4, 7, and 9.",Sound recording upload coming. 4 specific individuals noted calling along a power line break,Myiarchus crinitus,grcfly,Species,17334,,1.5,2,,,
624430661,Audio,Great Crested Flycatcher,Myiarchus crinitus,,,Anne Miller,10/1/24,2024,10,1,1429,United States,US-NC-183,North Carolina,Wake,"4140–4470 Bartley Holleman Rd, New Hill US-NC 35.60541, -78.93660",35.605412,-78.936599,,,Unspecified,FALSE,FALSE,,,,,,,S197261539,,,,,Calling recorded - a bit late,Myiarchus crinitus,grcfly,Species,17334,,1,1,,,
623423565,Audio,Great Crested Flycatcher,Myiarchus crinitus,,,Guy McGrane,9/5/24,2024,9,5,0,United States,US-NC-189,North Carolina,Watauga,Brookshire Park--Loop and Greenway,36.2240894,-81.6426766,,,Unspecified,FALSE,FALSE,,,,,,,S194235645,,,,,,Myiarchus crinitus,grcfly,Species,17334,,1,1,,,
622949535,Audio,Great Crested Flycatcher,Myiarchus crinitus,,,Alex Colucci,4/25/23,2023,4,25,713,United States,US-NC-055,North Carolina,Dare,Pea Island NWR--North Pond Wildlife Trail,35.7156212,-75.4935891,Adult – 1,Call,Not Used,,,,,,,,,S135034827,,,,,,Myiarchus crinitus,grcfly,Species,17334,,2,1,,,
622493765,Audio,Great Crested Flycatcher,Myiarchus crinitus,,,Jeffrey Blalock,8/13/24,2024,8,13,730,United States,US-NC-077,North Carolina,Granville,Horseshoe Road Nature Preserve,36.0858639,-78.6250779,,,Unspecified,FALSE,FALSE,,,,,,,S191307930,,,,,,Myiarchus crinitus,grcfly,Species,17334,,4,2,,,
621939751,Audio,Great Crested Flycatcher,Myiarchus crinitus,,,Alex Trifunovic,6/20/24,2024,6,20,547,United States,US-NC-035,North Carolina,Catawba,"Millersville SE- 4442–4600 Deal Rd (35.7594,-81.1364)",35.759411,-81.136376,,Dawn Song,Unspecified,,,,,,,,,S182680028,,,,,Dawn song,Myiarchus crinitus,grcfly,Species,17334,,3,1,,,
621937559,Audio,Great Crested Flycatcher,Myiarchus crinitus,Thryothorus ludovicianus [ludovicianus Group] -- Carolina Wren (Northern); Melospiza melodia melodia/atlantica -- Song Sparrow (melodia/atlantica); Dumetella carolinensis -- Gray Catbird,,Alex Trifunovic,5/17/24,2024,5,17,1015,United States,US-NC-097,North Carolina,Iredell,"Statesville West SE- Oakwood Cemetery, Evergreen Dr",35.79058,-80.876389,,Call,Unspecified,,,,,,,,,S175076584,,,,,"Pair siting together in magnolia giving contact calls and loud “wheeep” calls, then more came closer and they all started calling at the same time",Myiarchus crinitus,grcfly,Species,17334,,3,1,,,
621123634,Audio,Great Crested Flycatcher,Myiarchus crinitus,,,Paul Beerman,7/2/24,2024,7,2,621,United States,US-NC-067,North Carolina,Forsyth,"5021 Hidden Lake Trail, Lewisville US-NC 36.08495, -80.50280",36.08495,-80.502796,,,Unspecified,FALSE,FALSE,,,,,,,S184937445,,,,,,Myiarchus crinitus,grcfly,Species,17334,,3.5,2,,,
620883612,Audio,Great Crested Flycatcher,Myiarchus crinitus,,,David Walters,6/26/24,2024,6,26,1311,United States,US-NC-081,North Carolina,Guilford,Lake Daniel Park,36.0796648,-79.807654,,,Unspecified,FALSE,FALSE,,,,,,,S183894117,,,,,,Myiarchus crinitus,grcfly,Species,17334,,1,1,,,
620264476,Audio,Great Crested Flycatcher,Myiarchus crinitus,,,Ralph Erickson,6/10/24,2024,6,10,550,United States,US-NC-001,North Carolina,Alamance,Amick Rd./Guilford County Farm (ALAMANCE Co.),36.13327,-79.52901,,,Unspecified,FALSE,FALSE,,,,,,,S180597432,,,,,,Myiarchus crinitus,grcfly,Species,17334,,3,2,,,
620264465,Audio,Great Crested Flycatcher,Myiarchus crinitus,,,Ralph Erickson,6/10/24,2024,6,10,550,United States,US-NC-001,North Carolina,Alamance,Amick Rd./Guilford County Farm (ALAMANCE Co.),36.13327,-79.52901,,,Unspecified,FALSE,FALSE,,,,,,,S180597432,,,,,,Myiarchus crinitus,grcfly,Species,17334,,4,2,,,
619866569,Audio,Great Crested Flycatcher,Myiarchus crinitus,,,Denise Hargrove,5/31/24,2024,5,31,1545,United States,US-NC-021,North Carolina,Buncombe,*25 Jazaka Ridge Ln,35.6209483,-82.4279147,,,Unspecified,FALSE,FALSE,,,,,,,S178505027,,,,,"Calling, moving through.",Myiarchus crinitus,grcfly,Species,17334,,3,1,,,
619519971,Audio,Great Crested Flycatcher,Myiarchus crinitus,,,gary cottrell,5/24/24,2024,5,24,632,United States,US-NC-119,North Carolina,Mecklenburg,"316 Wingrave Dr, Charlotte US-NC 35.15222, -80.77857",35.152224,-80.77857,,,Unspecified,FALSE,FALSE,,,,,,,S176694775,,,,,,Myiarchus crinitus,grcfly,Species,17334,,2,1,,,
619296541,Audio,Great Crested Flycatcher,Myiarchus crinitus,,,Sandy Melton,5/19/24,2024,5,19,1315,United States,US-NC-115,North Carolina,Madison,Nowhere Branch Farm,35.8136594,-82.6059806,,,Unspecified,FALSE,FALSE,,,,,,,S175714094,,,,,,Myiarchus crinitus,grcfly,Species,17334,,2,1,,,
618969341,Audio,Great Crested Flycatcher,Myiarchus crinitus,,,Karen 🦉 Szafrajda,4/20/24,2024,4,20,645,United States,US-NC-085,North Carolina,Harnett,My Place KS,35.2888107,-79.0280075,Adult – 1,Call,Unspecified,,,,,,,,,S169413094,,,,,Heard two at the same time visualized one  very close. Female bluebird taste away,Myiarchus crinitus,grcfly,Species,17334,,0,0,,,
618374805,Audio,Great Crested Flycatcher,Myiarchus crinitus,,,Martin Wall,5/3/24,2024,5,3,539,United States,US-NC-031,North Carolina,Carteret,"Neusiok Trail, Newport US-NC 34.83434, -76.78717",34.834342,-76.787172,,Dawn Song,Not Used,,,,,iPhone SE,,,,S171677785,,,,,,Myiarchus crinitus,grcfly,Species,17334,,0,0,,,
618128228,Audio,Great Crested Flycatcher,Myiarchus crinitus,,,David Mitzi,4/28/24,2024,4,28,1956,United States,US-NC-135,North Carolina,Orange,Fox Hill Farms,36.105706,-79.049948,,,Unspecified,FALSE,FALSE,,,,,,,S170867061,,,,,Seemingly one of the last birds to be vocalizing in my yard in the evening...,Myiarchus crinitus,grcfly,Species,17334,,3,1,,,
618067108,Audio,Great Crested Flycatcher,Myiarchus crinitus,,,Nancy Kondracki,4/27/24,2024,4,27,1853,United States,US-NC-081,North Carolina,Guilford,"5211 Flintrock Court, Greensboro, North Carolina, US (36.152, -79.797)",36.1522204,-79.7972791,,,Unspecified,FALSE,FALSE,,,,,,,S170657253,,,,,"Clearly heard 2 calling back and forth from trees in different areas of the property, then one flew off so quickly that all I could see, as it was nearing dusk, was a dark gray slim body.",Myiarchus crinitus,grcfly,Species,17334,,0,0,,,
618054779,Audio,Great Crested Flycatcher,Myiarchus crinitus,,,Morgan Reisinger,4/27/24,2024,4,27,1822,United States,US-NC-135,North Carolina,Orange,Mason Farm Biological Reserve,35.8849444,-79.0145083,,,Unspecified,FALSE,FALSE,,,,,,,S170634470,,,,,,Myiarchus crinitus,grcfly,Species,17334,,5,2,,,
618037823,Audio,Great Crested Flycatcher,Myiarchus crinitus,,,Bird Smith,4/27/24,2024,4,27,1641,United States,US-NC-175,North Carolina,Transylvania,Westridge area (private),35.118125,-82.935414,,,Unspecified,FALSE,FALSE,,,,,,,S170596934,,,,,,Myiarchus crinitus,grcfly,Species,17334,,2,1,,,
617884843,Audio,Great Crested Flycatcher,Myiarchus crinitus,,,Kent Fiala,4/22/24,2024,4,22,807,United States,US-NC-063,North Carolina,Durham,Sandy Creek Park,35.9681599,-78.9675164,,Call,Not Used,,,,,Samsung Galaxy S22+,,,,S169796766,,,,,,Myiarchus crinitus,grcfly,Species,17334,,4,1,,,
617613507,Audio,Great Crested Flycatcher,Myiarchus crinitus,,,Keith Viglietta,4/19/24,2024,4,19,1340,United States,US-NC-149,North Carolina,Polk,"Dalton Rd, Mill Spring (private road)",35.3164263,-82.1437048,,,Unspecified,FALSE,FALSE,,,,,,,S169321596,,,,,,Myiarchus crinitus,grcfly,Species,17334,,0,0,,,
617490369,Audio,Great Crested Flycatcher,Myiarchus crinitus,,,Heather Buttonow,4/16/24,2024,4,16,1209,United States,US-NC-081,North Carolina,Guilford,Reedy Fork Trail,36.1736402,-79.8375628,,,Unspecified,FALSE,FALSE,,,,,,,S168921338,,,,,,Myiarchus crinitus,grcfly,Species,17334,,1,1,,,
616876896,Audio,Great Crested Flycatcher,Myiarchus crinitus,,,Karen 🦉 Szafrajda,4/3/24,2024,4,3,1827,United States,US-NC-085,North Carolina,Harnett,trail patch,35.2882767,-79.0318146,,,Unspecified,FALSE,FALSE,,,,,,,S167090543,,,,,First if the year.  Heard calling multiple times picked up by Merlin audio eventually able to obtain images,Myiarchus crinitus,grcfly,Species,17334,,4,2,,,
616851163,Audio,Great Crested Flycatcher,Myiarchus crinitus,Haemorhous mexicanus -- House Finch; Spizella passerina -- Chipping Sparrow; Mimus polyglottos -- Northern Mockingbird; Thryothorus ludovicianus -- Carolina Wren; Cardinalis cardinalis -- Northern Cardinal,,Kristen Johnson,4/3/24,2024,4,3,719,United States,US-NC-129,North Carolina,New Hanover,"Magnolia Ave, Carolina Beach (34.0391,-77.9053)",34.039063,-77.905302,,Call,Unspecified,,,,,iPhone SE,,,,S167025714,,,,lots of wind and traffic noise,"early, but first heard yesterday morning; characteristic “whee-eep” call; very close and loud to start but of course once I started recording it was much farther away",Myiarchus crinitus,grcfly,Species,17334,,2,1,,,
616820028,Audio,Great Crested Flycatcher,Myiarchus crinitus,,,Trenton Voytko,4/2/24,2024,4,2,812,United States,US-NC-103,North Carolina,Jones,Croatan NF--Long Point Rd.,34.8065448,-77.164793,Unknown – 1,Call,Unspecified,,,,,,,,,S166940627,,,,,"*Only a few days early  Burry, rolling calls from mixed forested lowlands. Also rising ""mweep!"" Audio taken.",Myiarchus crinitus,grcfly,Species,17334,,0,0,,,
611663520,Audio,Great Crested Flycatcher,Myiarchus crinitus,,,Bird Smith,9/18/23,2023,9,18,915,United States,US-NC-175,North Carolina,Transylvania,Pisgah NF--Davidson River Campground,35.2830135,-82.7256668,,,Unspecified,FALSE,FALSE,,,,,,,S150204684,,,,,,Myiarchus crinitus,grcfly,Species,17334,,4,2,,,
609272677,Audio,Great Crested Flycatcher,Myiarchus crinitus,,,Katherine Thorington,9/25/23,2023,9,25,1739,United States,US-NC-125,North Carolina,Moore,Weymouth Woods Sandhills Nature Preserve,35.1471875,-79.3689895,,,Unspecified,FALSE,FALSE,,,,,,,S150765314,,,,,Greep call recorded with Merlin,Myiarchus crinitus,grcfly,Species,17334,,5,2,,,
608764491,Audio,Great Crested Flycatcher,Myiarchus crinitus,,,Karen Lebing,9/12/23,2023,9,12,656,United States,US-NC-055,North Carolina,Dare,Alligator River NWR--Creef Cut Wildlife Trail,35.8637577,-75.8607094,Adult – 1,Call; Foraging or Eating,Unspecified,,,,,iPhone,,,,S149705251,,,,,,Myiarchus crinitus,grcfly,Species,17334,,3,1,,,
604901771,Audio,Great Crested Flycatcher,Myiarchus crinitus,Thryothorus ludovicianus -- Carolina Wren,,Joe Donahue,8/15/23,2023,8,15,714,United States,US-NC-135,North Carolina,Orange,Brumley Nature Preserve--North,36.03391,-79.041909,Adult – 2; Immature – 2,Call; Foraging or Eating,Unspecified,,,,,Iphone 13,,,,S147301065,,,,,,Myiarchus crinitus,grcfly,Species,17334,,2,1,,,
599520751,Audio,Great Crested Flycatcher,Myiarchus crinitus,,,Micah Newman,8/1/23,2023,8,1,1735,United States,US-NC-021,North Carolina,Buncombe,Rusty Clay Ridge,35.5376135,-82.3817879,,,Unspecified,FALSE,FALSE,,,,,,,S146214885,,,,,Identified by sound in Merlin,Myiarchus crinitus,grcfly,Species,17334,,1,1,,,
596645691,Audio,Great Crested Flycatcher,Myiarchus crinitus,,,A J,7/23/23,2023,7,23,956,United States,US-NC-001,North Carolina,Alamance,yard,36.0916461,-79.5000054,,,Unspecified,FALSE,FALSE,,,,,,,S145383439,,,,,,Myiarchus crinitus,grcfly,Species,17334,,3,1,,,
595927361,Audio,Great Crested Flycatcher,Myiarchus crinitus,,,Jacob Clark,7/20/23,2023,7,20,1957,United States,US-NC-049,North Carolina,Craven,New Bern Battlefield Park,35.0477225,-77.0158727,,,Unspecified,FALSE,FALSE,,,,,,,S145143047,,,,,,Myiarchus crinitus,grcfly,Species,17334,,4,2,,,
588842311,Audio,Great Crested Flycatcher,Myiarchus crinitus,,,Eric Cameron,6/19/23,2023,6,19,635,United States,US-NC-031,North Carolina,Carteret,"7020 Sound Dr, Emerald Isle US-NC (34.6745,-77.0155)",34.674479,-77.015481,,,Unspecified,FALSE,FALSE,,,,,,,S142054281,,,,,,Myiarchus crinitus,grcfly,Species,17334,,4,2,,,
586980831,Audio,Great Crested Flycatcher,Myiarchus crinitus,,,Guy McGrane,5/14/23,2023,5,14,1000,United States,US-NC-189,North Carolina,Watauga,Valle Crucis Community Park,36.2119914,-81.7757893,,,Unspecified,FALSE,FALSE,,,,,,,S137914606,,,,,,Myiarchus crinitus,grcfly,Species,17334,,1,1,,,
585959001,Audio,Great Crested Flycatcher,Myiarchus crinitus,,,Karen Lebing,6/18/23,2023,6,18,931,United States,US-NC-055,North Carolina,Dare,Alligator River NWR--Creef Cut Wildlife Trail,35.8637577,-75.8607094,Adult – 1,Call; Foraging or Eating,Unspecified,,,,,iPhone,,,,S141947302,,,,,,Myiarchus crinitus,grcfly,Species,17334,,3,1,,,
583315111,Audio,Great Crested Flycatcher,Myiarchus crinitus,,,Leah McMillion,6/10/23,2023,6,10,1840,United States,US-NC-031,North Carolina,Carteret,A Beautiful View,34.672803,-76.98115,,,Unspecified,FALSE,FALSE,,,,,,,S141156001,,,,,Audio,Myiarchus crinitus,grcfly,Species,17334,,3,1,,,
580029141,Audio,Great Crested Flycatcher,Myiarchus crinitus,,,Karen Lebing,6/1/23,2023,6,1,958,United States,US-NC-055,North Carolina,Dare,Alligator River NWR--Creef Cut Wildlife Trail,35.8637577,-75.8607094,Adult – 1,Call; Foraging or Eating,Unspecified,,,,,iPhone,,,,S140113728,,,,,,Myiarchus crinitus,grcfly,Species,17334,,3,1,,,
577331521,Audio,Great Crested Flycatcher,Myiarchus crinitus,,,Benjamin Filreis,5/17/23,2023,5,17,945,United States,US-NC-055,North Carolina,Dare,"229 Wax Myrtle Trail, Southern Shores US-NC 36.13080, -75.73353",36.130801,-75.733528,,,Unspecified,FALSE,FALSE,,,,,,,S138112536,,,,,,Myiarchus crinitus,grcfly,Species,17334,,3,1,,,
574806061,Audio,Great Crested Flycatcher,Myiarchus crinitus,,,Seth Buddy,5/20/23,2023,5,20,710,United States,US-NC-021,North Carolina,Buncombe,"Pisgah National Forest, Candler US-NC 35.51788, -82.65221",35.517876,-82.65221,Unknown – 1,Call,Not Used,,,,,Tascam DR-100MKIII,Wildtronics Pro Mono,"Wildtronics 22"" parabola; windscreen",,S138482201,,,,GCFL flew high into an oak and called a few times.  Habitat is recently-logged shelterwood parcel bordered by a mature mixed hardwood forest.,,Myiarchus crinitus,grcfly,Species,17334,,1,1,,,
567472001,Audio,Great Crested Flycatcher,Myiarchus crinitus,,,Guy McGrane,5/5/23,2023,5,5,1500,United States,US-NC-189,North Carolina,Watauga,Boone Greenway Trail,36.2144561,-81.6465175,,,Unspecified,FALSE,FALSE,,,,,,,S136204209,,,,"Nice series of calls, especially after the recorder was reset about 10 seconds in.","Calls recorded and will be attached. Very close looks at this flycatcher from about 20 feet away, as it landed in a tree only about 10 feet from me down low. Spooked when I raised binoculars, but only flew about 10 feet higher and allowed best views I've had of this species in many years. The gray around the neck and chest area was so dark it was almost blue and the yellow below was very bright, with a hint of cinnamon brown in the wings. A stunning bird at close range and one that is most likely a migrant as they don't seem to nest anywhere close to here.",Myiarchus crinitus,grcfly,Species,17334,,4,1,,,
567377861,Audio,Great Crested Flycatcher,Myiarchus crinitus,,,kenneth lipshy,5/5/23,2023,5,5,735,United States,US-NC-159,North Carolina,Rowan,Salisbury VA Hospital,35.6839321,-80.4885864,,,Unspecified,FALSE,FALSE,,,,,,,S136126572,,,,,,Myiarchus crinitus,grcfly,Species,17334,,5,1,,,
567377871,Audio,Great Crested Flycatcher,Myiarchus crinitus,,,kenneth lipshy,5/5/23,2023,5,5,735,United States,US-NC-159,North Carolina,Rowan,Salisbury VA Hospital,35.6839321,-80.4885864,,,Unspecified,FALSE,FALSE,,,,,,,S136126572,,,,,,Myiarchus crinitus,grcfly,Species,17334,,4,1,,,
566346601,Audio,Great Crested Flycatcher,Myiarchus crinitus,,,kenneth lipshy,5/3/23,2023,5,3,722,United States,US-NC-159,North Carolina,Rowan,Salisbury VA Hospital,35.6839321,-80.4885864,,,Unspecified,FALSE,FALSE,,,,,,,S135904397,,,,,,Myiarchus crinitus,grcfly,Species,17334,,5,1,,,
565452871,Audio,Great Crested Flycatcher,Myiarchus crinitus,,,Anne C,5/1/23,2023,5,1,0,United States,US-NC-021,North Carolina,Buncombe,Browntown Rd,35.6193694,-82.7236163,,,Unspecified,FALSE,FALSE,,,,,,,S135692060,,,,Only called once in this recording around 22 seconds.,,Myiarchus crinitus,grcfly,Species,17334,,3,1,,,
564493281,Audio,Great Crested Flycatcher,Myiarchus crinitus,,,Karen Lebing,4/29/23,2023,4,29,721,United States,US-NC-055,North Carolina,Dare,Alligator River NWR--Possum Rd.,35.7910596,-75.9169264,Adult – 1,Call; Foraging or Eating,Unspecified,,,,,iPhone,,,,S135391683,,,,,,Myiarchus crinitus,grcfly,Species,17334,,3,1,,,
562911111,Audio,Great Crested Flycatcher,Myiarchus crinitus,,,Jeffrey Blalock,4/25/23,2023,4,25,1115,United States,US-NC-145,North Carolina,Person,"St Paul Church Rd, Roxboro US-NC",36.424212,-78.838115,,,Unspecified,FALSE,FALSE,,,,,,,S134980113,,,,,,Myiarchus crinitus,grcfly,Species,17334,,3.5,2,,,
561854381,Audio,Great Crested Flycatcher,Myiarchus crinitus,,,Karen Lebing,4/23/23,2023,4,23,1719,United States,US-NC-055,North Carolina,Dare,Waves soundfront,35.5622821,-75.4715037,Adult – 1,,Unspecified,FALSE,FALSE,,,iPhone,,,,S134784935,,,,,,Myiarchus crinitus,grcfly,Species,17334,,2.5,2,,,
560774671,Audio,Great Crested Flycatcher,Myiarchus crinitus,,,Martin Wall,4/21/23,2023,4,21,711,United States,US-NC-031,North Carolina,Carteret,"Croatan National Forest, Swansboro US-NC (34.8181,-76.7953)",34.818125,-76.795292,Adult – 1,Call,Not Used,,,,,iPhone SE,,,,S134470587,,,,,,Myiarchus crinitus,grcfly,Species,17334,,3,1,,,
559407111,Audio,Great Crested Flycatcher,Myiarchus crinitus,,,Caleb Bronsink,4/18/23,2023,4,18,730,United States,US-NC-147,North Carolina,Pitt,Greenville--River Park North,35.6264831,-77.361517,,,Unspecified,FALSE,FALSE,,,,,,,S134167384,,,,,,Myiarchus crinitus,grcfly,Species,17334,,4,2,,,
558993161,Audio,Great Crested Flycatcher,Myiarchus crinitus,,,Claudia Nielson,4/16/23,2023,4,16,1524,United States,US-NC-067,North Carolina,Forsyth,Tanglewood Park--Yadkin River Nature Trail,35.9980801,-80.4150724,,,Unspecified,FALSE,FALSE,,,,,,,S134024601,,,,,,Myiarchus crinitus,grcfly,Species,17334,,3.33,3,,,
558796691,Audio,Great Crested Flycatcher,Myiarchus crinitus,Buteo lineatus -- Red-shouldered Hawk; Dryocopus pileatus -- Pileated Woodpecker; Pipilo erythrophthalmus -- Eastern Towhee; Cardinalis cardinalis -- Northern Cardinal; Thryothorus ludovicianus -- Carolina Wren; Poecile carolinensis -- Carolina Chickadee; Spinus tristis -- American Goldfinch,,Jesse Haaf,4/16/23,2023,4,16,921,United States,US-NC-067,North Carolina,Forsyth,Reynolda,36.1266446,-80.2826786,,,Unspecified,FALSE,FALSE,,,,,,,S133992602,,,,,,Myiarchus crinitus,grcfly,Species,17334,,2.33,3,,,
558180451,Audio,Great Crested Flycatcher,Myiarchus crinitus,,,Chip Davis,4/15/23,2023,4,15,622,United States,US-NC-183,North Carolina,Wake,American Tobacco Trail--Olive Chapel Road Access,35.7289383,-78.9312315,,,Unspecified,FALSE,FALSE,,,,,,,S133880312,,,,,,Myiarchus crinitus,grcfly,Species,17334,,3.5,2,,,
557317811,Audio,Great Crested Flycatcher,Myiarchus crinitus,,,Martin Wall,4/12/23,2023,4,12,643,United States,US-NC-031,North Carolina,Carteret,"Croatan National Forest, Newport US-NC (34.7679,-76.9443)",34.7679,-76.944335,Adult – 1,Call,Not Used,,,,,iPhone SE,,,,S133505486,,,,,,Myiarchus crinitus,grcfly,Species,17334,,3,1,,,
555085671,Audio,Great Crested Flycatcher,Myiarchus crinitus,,,Katherine Thorington,4/6/23,2023,4,6,1554,United States,US-NC-125,North Carolina,Moore,Weymouth Woods Sandhills Nature Preserve--Boyd Tract,35.1670617,-79.3764031,,,Unspecified,FALSE,FALSE,,,,,,,S132904357,,,,,Herd and then recorded greep call via Merlin first call is just after 14 seconds,Myiarchus crinitus,grcfly,Species,17334,,3,1,,,
552553671,Audio,Great Crested Flycatcher,Myiarchus crinitus,,,Trenton Voytko,4/2/23,2023,4,2,735,United States,US-NC-133,North Carolina,Onslow,White Oak River Impoundment,34.7631761,-77.1503644,,,Unspecified,FALSE,FALSE,,,,,,,S132480483,,,,,"Early, by a hair.  Heard only, classic rolling ""mweep!"" calls from appropriate habitat. Responded in turn to GCFL call notes by vocalizing more aggressively.",Myiarchus crinitus,grcfly,Species,17334,,3,1,,,
539741421,Audio,Great Crested Flycatcher,Myiarchus crinitus,,,Trenton Voytko,5/22/22,2022,5,22,1741,United States,US-NC-183,North Carolina,Wake,Apex Community Park,35.7521894,-78.8255095,,,Unspecified,FALSE,FALSE,,,,,,,S111038130,,,,,,Myiarchus crinitus,grcfly,Species,17334,,4.5,2,,,
511228101,Audio,Great Crested Flycatcher,Myiarchus crinitus,,,Christine Stoughton Root,9/25/22,2022,9,25,725,United States,US-NC-013,North Carolina,Beaufort,"304 Paradox Point Dr, Aurora US-NC (35.2790,-76.6478)",35.279008,-76.647783,,,Unspecified,FALSE,FALSE,,,,,,,S119417939,,,,,Brief recording and sighting. Common here just a bit late leaving. Large gray bird with crest yellow bellied,Myiarchus crinitus,grcfly,Species,17334,,3,3,,,
489737241,Audio,Great Crested Flycatcher,Myiarchus crinitus,,,Luke Bennett,9/25/22,2022,9,25,1900,United States,US-NC-037,North Carolina,Chatham,Jordan Lake SRA--Ebenezer Point,35.7081198,-79.0276623,,,Unspecified,FALSE,FALSE,,,,,,,S119864392,,,,,No visual. Loud and distinct vocalization at dusk,Myiarchus crinitus,grcfly,Species,17334,,3,2,,,
487401081,Audio,Great Crested Flycatcher,Myiarchus crinitus,,,Jim Gant,9/24/22,2022,9,24,1321,United States,US-NC-081,North Carolina,Guilford,Lake Brandt--Palmetto Trail,36.146536,-79.857065,,,Unspecified,FALSE,FALSE,,,,,,,S119369588,,,,,,Myiarchus crinitus,grcfly,Species,17334,,3,2,,,
475941781,Audio,Great Crested Flycatcher,Myiarchus crinitus,Poecile carolinensis -- Carolina Chickadee; Corvus brachyrhynchos -- American Crow; Spinus tristis -- American Goldfinch; Cardinalis cardinalis -- Northern Cardinal; Thryothorus ludovicianus -- Carolina Wren,,A J,8/17/22,2022,8,17,634,United States,US-NC-001,North Carolina,Alamance,Mill Pointe Way dam,36.089541,-79.498054,,Call,Unspecified,,,,,,,,,S117082406,,,,,,Myiarchus crinitus,grcfly,Species,17334,,3,1,,,
475941431,Audio,Great Crested Flycatcher,Myiarchus crinitus,Poecile carolinensis -- Carolina Chickadee; Corvus brachyrhynchos -- American Crow,,A J,8/17/22,2022,8,17,634,United States,US-NC-001,North Carolina,Alamance,Mill Pointe Way dam,36.089541,-79.498054,,Call,Unspecified,,,,,,,,,S117082406,,,,,,Myiarchus crinitus,grcfly,Species,17334,,3,1,,,
475941121,Audio,Great Crested Flycatcher,Myiarchus crinitus,,,A J,8/17/22,2022,8,17,634,United States,US-NC-001,North Carolina,Alamance,Mill Pointe Way dam,36.089541,-79.498054,,Call,Unspecified,,,,,,,,,S117082406,,,,,,Myiarchus crinitus,grcfly,Species,17334,,2,1,,,
470853791,Audio,Great Crested Flycatcher,Myiarchus crinitus,Colinus virginianus -- Northern Bobwhite,,Cody Peters,7/7/22,2022,7,7,619,United States,US-NC-031,North Carolina,Carteret,Croatan NF--Patsy Pond Nature Trail,34.7191287,-76.9634398,,Call,Unspecified,,,,,,,,,S114576154,,,,,,Myiarchus crinitus,grcfly,Species,17334,,3,1,,,
469578461,Audio,Great Crested Flycatcher,Myiarchus crinitus,,,Richard Zapfel,7/6/22,2022,7,6,1007,United States,US-NC-055,North Carolina,Dare,Nags Head Woods Ecological Preserve,35.9894485,-75.6655669,,,Unspecified,FALSE,FALSE,,,,,,,S114529228,,,,,,Myiarchus crinitus,grcfly,Species,17334,,3,1,,,
456557121,Audio,Great Crested Flycatcher,Myiarchus crinitus,,,Beth OBriant,6/4/22,2022,6,4,722,United States,US-NC-053,North Carolina,Currituck,O'Briant's Bird Watch,36.495635,-76.047751,,,Unspecified,FALSE,FALSE,,,,,,,S112160975,,,,,Picked up by Merlin Sound,Myiarchus crinitus,grcfly,Species,17334,,3.5,2,,,
450027721,Audio,Great Crested Flycatcher,Myiarchus crinitus,,,Kent Fiala,5/17/22,2022,5,17,752,United States,US-NC-135,North Carolina,Orange,Carolina North Forest--West,35.9357903,-79.0829773,,Call,Not Used,,,,,Samsung Galaxy S9+,,,,S110468569,,,,,,Myiarchus crinitus,grcfly,Species,17334,,4,2,,,
449888651,Audio,Great Crested Flycatcher,Myiarchus crinitus,,,LynnErla Beegle,5/16/22,2022,5,16,917,United States,US-NC-063,North Carolina,Durham,"NCBA MST South Of Cheek Rd,(36.041, -78.758)",36.0411393,-78.7578824,,,Unspecified,FALSE,FALSE,,,,,,,S110365524,,,,,"3 in one spot, family unit, noisy, FL",Myiarchus crinitus,grcfly,Species,17334,,3,1,,,
448061221,Audio,Great Crested Flycatcher,Myiarchus crinitus,,,Beth OBriant,5/13/22,2022,5,13,948,United States,US-NC-053,North Carolina,Currituck,O'Briant's Bird Watch,36.495635,-76.047751,,,Unspecified,FALSE,FALSE,,,,,,,S109925911,,,,,Picked up by Merlin Sound,Myiarchus crinitus,grcfly,Species,17334,,2,1,,,
445902151,Audio,Great Crested Flycatcher,Myiarchus crinitus,,,Guy McGrane,5/8/22,2022,5,8,800,United States,US-NC-189,North Carolina,Watauga,Boone Greenway Trail,36.2144561,-81.6465175,,,Unspecified,FALSE,FALSE,,,,,,,S109390728,,,,,,Myiarchus crinitus,grcfly,Species,17334,,3,2,,,
444914951,Audio,Great Crested Flycatcher,Myiarchus crinitus,,,Dale Lambert,5/6/22,2022,5,6,644,United States,US-NC-183,North Carolina,Wake,Mid Pines Rd.,35.7250538,-78.6936951,,,Unspecified,FALSE,FALSE,,,,,,,S109140196,,,,,,Myiarchus crinitus,grcfly,Species,17334,,3.5,2,,,
443079831,Audio,Great Crested Flycatcher,Myiarchus crinitus,Vireo olivaceus -- Red-eyed Vireo; Melanerpes carolinus -- Red-bellied Woodpecker; Setophaga dominica -- Yellow-throated Warbler; Setophaga pinus -- Pine Warbler,,Kent Fiala,5/2/22,2022,5,2,705,United States,US-NC-135,North Carolina,Orange,Brumley Nature Preserve--South,36.031475,-79.05894,Adult – 1,,Not Used,,,,,Tascam DR-100MkIII ,Sennheiser ME67/K6,,,S108716088,,,,,,Myiarchus crinitus,grcfly,Species,17334,,4.5,2,,,
441709541,Audio,Great Crested Flycatcher,Myiarchus crinitus,,,Abbie Valine,4/29/22,2022,4,29,1452,United States,US-NC-147,North Carolina,Pitt,Greenville--River Park North,35.6264831,-77.361517,,,Unspecified,FALSE,FALSE,,,,,,,S108402679,,,,,,Myiarchus crinitus,grcfly,Species,17334,,3,1,,,
441249491,Audio,Great Crested Flycatcher,Myiarchus crinitus,,,Brooks Emanuel,4/27/22,2022,4,27,1809,United States,US-NC-063,North Carolina,Durham,Penny's Bend Nature Preserve,36.0732309,-78.8632075,,,Unspecified,FALSE,FALSE,,,,,,,S108251687,,,,,heard only,Myiarchus crinitus,grcfly,Species,17334,,3.5,2,,,
441234191,Audio,Great Crested Flycatcher,Myiarchus crinitus,Vireo griseus -- White-eyed Vireo; Corvus brachyrhynchos -- American Crow; Piranga olivacea -- Scarlet Tanager; Hylocichla mustelina -- Wood Thrush; Setophaga citrina -- Hooded Warbler; Dumetella carolinensis -- Gray Catbird; Sayornis phoebe -- Eastern Phoebe; Zenaida macroura -- Mourning Dove; Melanerpes carolinus -- Red-bellied Woodpecker; Cardinalis cardinalis -- Northern Cardinal,,Martin Wall,4/28/22,2022,4,28,722,United States,US-NC-157,North Carolina,Rockingham,Dan River Nature Trail,36.486587,-79.761015,Adult Male – 1,Call; Song,Not Used,,,,,iPhone SE,,,,S108277129,,,,,,Myiarchus crinitus,grcfly,Species,17334,,3,1,,,
440609391,Audio,Great Crested Flycatcher,Myiarchus crinitus,,,Jay Carroll,4/19/22,2022,4,19,754,United States,US-NC-093,North Carolina,Hoke,"233 Lycon Hill Ln, Raeford US-NC 35.03159, -79.31057",35.031594,-79.31057,,,Unspecified,FALSE,FALSE,,,,,,,S107505206,,,,,,Myiarchus crinitus,grcfly,Species,17334,,1,1,,,
440516601,Audio,Great Crested Flycatcher,Myiarchus crinitus,,,Denise Hargrove,4/25/22,2022,4,25,730,United States,US-NC-021,North Carolina,Buncombe,*25 Jazaka Ridge Ln,35.6209483,-82.4279147,,,Unspecified,FALSE,FALSE,,,,,,,S108146841,,,,,,Myiarchus crinitus,grcfly,Species,17334,,3,1,,,
440461961,Audio,Great Crested Flycatcher,Myiarchus crinitus,,,Mark Kosiewski,4/24/22,2022,4,24,714,United States,US-NC-001,North Carolina,Alamance,Cane Creek Mountains Natural Area,35.9551,-79.41719,,,Unspecified,FALSE,FALSE,,,,,,,S107883454,,,,,,Myiarchus crinitus,grcfly,Species,17334,,3,1,,,
439469461,Audio,Great Crested Flycatcher,Myiarchus crinitus,,,Keith Viglietta,4/24/22,2022,4,24,700,United States,US-NC-149,North Carolina,Polk,"Polk County Community Green, Mill Spring, US-NC",35.334974,-82.143309,,,Unspecified,FALSE,FALSE,,,,,,,S107927583,,,,,,Myiarchus crinitus,grcfly,Species,17334,,3,1,,,
439468281,Audio,Great Crested Flycatcher,Myiarchus crinitus,,,Keith Viglietta,4/24/22,2022,4,24,700,United States,US-NC-149,North Carolina,Polk,"Polk County Community Green, Mill Spring, US-NC",35.334974,-82.143309,,,Unspecified,FALSE,FALSE,,,,,,,S107927583,,,,,,Myiarchus crinitus,grcfly,Species,17334,,2,1,,,
438923121,Audio,Great Crested Flycatcher,Myiarchus crinitus,,,Keith Viglietta,4/23/22,2022,4,23,1245,United States,US-NC-149,North Carolina,Polk,"Dalton Rd, Mill Spring (private road)",35.3164263,-82.1437048,,,Unspecified,FALSE,FALSE,,,,,,,S107797893,,,,,,Myiarchus crinitus,grcfly,Species,17334,,2,1,,,
435727721,Audio,Great Crested Flycatcher,Myiarchus crinitus,,,Thomas Sanders,4/15/22,2022,4,15,856,United States,US-NC-119,North Carolina,Mecklenburg,McAlpine Creek Park,35.1508807,-80.740993,,,Unspecified,FALSE,FALSE,,,,,,,S107104539,,,,,,Myiarchus crinitus,grcfly,Species,17334,,3,1,,,
433247161,Audio,Great Crested Flycatcher,Myiarchus crinitus,Setophaga americana -- Northern Parula; Cardinalis cardinalis -- Northern Cardinal,,Michael Cheves,4/8/22,2022,4,8,1325,United States,US-NC-103,North Carolina,Jones,Island Creek Walk,35.0271449,-77.1363643,,,Not Used,,,,,Samsung Galaxy S21,None,None,,S106543971,,,,,"Unmistakable ""rreeep"" call and whistles heard near the creek, multiple calls, will add brief recording. Watched preening, had classic pale yellow belly, drab olive back and wing bars. A bit early FOS for me, but GCFL have already been reported this week from other coastal sites.",Myiarchus crinitus,grcfly,Species,17334,,3,1,,,
431686531,Audio,Great Crested Flycatcher,Myiarchus crinitus,,,Evangelyn Buckland,4/3/22,2022,4,3,1537,United States,US-NC-129,North Carolina,New Hanover,"39 Sunset Ave, Wilmington US-NC 34.20580, -77.94914",34.205804,-77.949144,,,Unspecified,FALSE,FALSE,,,,,,,S106203104,,,,,Unmistakeable. Heard and seen. Large flycatcher with yellow wash underparts & large crest,Myiarchus crinitus,grcfly,Species,17334,,2,1,,,
431596361,Audio,Great Crested Flycatcher,Myiarchus crinitus,,,Jeff Lewis,4/3/22,2022,4,3,655,United States,US-NC-055,North Carolina,Dare,Alligator River NWR,35.864075,-75.86201,,,Unspecified,FALSE,FALSE,,,,,,,S106170532,,,,,"Early! Heard distinct call several times and finally saw bird. Bright yellow belly, white breast and throat, brown above. Larger and brighter than Ash-throated. Recorded call.",Myiarchus crinitus,grcfly,Species,17334,,3,1,,,
431480881,Audio,Great Crested Flycatcher,Myiarchus crinitus,,,Audrey Whitlock,4/3/22,2022,4,3,655,United States,US-NC-055,North Carolina,Dare,Alligator River NWR,35.864075,-75.86201,,,Unspecified,FALSE,FALSE,,,,,,,S106179563,,,,,"Early! Heard distinct call several times and finally saw bird. Bright yellow belly, white breast and throat, brown above. Larger and brighter than Ash-throated. Recorded call.",Myiarchus crinitus,grcfly,Species,17334,,3,1,,,
402317031,Audio,Great Crested Flycatcher,Myiarchus crinitus,,,Dale Lambert,5/23/21,2021,5,23,533,United States,US-NC-183,North Carolina,Wake,Macedonia Lake/Speight Branch Greenway,35.748724,-78.7477255,,,Unspecified,FALSE,FALSE,,,,,,,S88842965,,,,,,Myiarchus crinitus,grcfly,Species,17334,,4,2,,,
374348821,Audio,Great Crested Flycatcher,Myiarchus crinitus,,,Caleb Bronsink,10/1/21,2021,10,1,814,United States,US-NC-147,North Carolina,Pitt,Field (private),35.4404346,-77.3261551,,,Unspecified,FALSE,FALSE,,,,,,,S95421539,,,,,Bird was calling in good habitat for about three minutes. Managed to get a recording.,Myiarchus crinitus,grcfly,Species,17334,,3,2,,,
371672431,Audio,Great Crested Flycatcher,Myiarchus crinitus,,,Seth Buddy,9/22/21,2021,9,22,1523,United States,US-NC-021,North Carolina,Buncombe,Asheville School,35.5646095,-82.6238863,Unknown – 1,Call,Not Used,,,,,iPhone 12,,,,S95029820,,,,Calling from a younger mixed hardwood forest between a playing field and a riparian habitat ,,Myiarchus crinitus,grcfly,Species,17334,,3,2,,,
361253651,Audio,Great Crested Flycatcher,Myiarchus crinitus,,,Aaron Edmonds,8/13/21,2021,8,13,1615,United States,US-NC-085,North Carolina,Harnett,River Field,35.3338183,-78.9342787,,,Unspecified,FALSE,FALSE,,,,,,,S93232213,,,,,,Myiarchus crinitus,grcfly,Species,17334,,3,1,,,
360113611,Audio,Great Crested Flycatcher,Myiarchus crinitus,,,Matthew Campbell,6/10/21,2021,6,10,1228,United States,US-NC-019,North Carolina,Brunswick,"Ash, North Carolina, US (34.004, -78.621)",34.0040141,-78.6210167,,,Unspecified,FALSE,FALSE,,,Zoom H6,Zoom H6 stereo shotgun microphone,,,S89987747,,,,"killdeer	great-crested flycatcher ",,Myiarchus crinitus,grcfly,Species,17334,,2,1,,,
360107251,Audio,Great Crested Flycatcher,Myiarchus crinitus,,,Matthew Campbell,6/9/21,2021,6,9,1825,United States,US-NC-019,North Carolina,Brunswick,Green Swamp Preserve,34.0890613,-78.2933807,,,Unspecified,FALSE,FALSE,,,Zoom H6,Zoom H6 stereo shotgun microphone,,,S92853157,,,,"bachman's sparrow	great-crested flycatcher ",,Myiarchus crinitus,grcfly,Species,17334,,3,1,,,
355286491,Audio,Great Crested Flycatcher,Myiarchus crinitus,,,Jeffrey Blalock,7/18/21,2021,7,18,715,United States,US-NC-183,North Carolina,Wake,Neuse River Trail--Abbotts Creek,35.9147972,-78.5711377,,,Unspecified,FALSE,FALSE,,,,,,,S91929975,,,,,,Myiarchus crinitus,grcfly,Species,17334,,4.5,2,,,
352895691,Audio,Great Crested Flycatcher,Myiarchus crinitus,,,Paul Beerman,7/7/21,2021,7,7,816,United States,US-NC-067,North Carolina,Forsyth,Long Creek Park,36.19242,-80.33374,,,Unspecified,FALSE,FALSE,,,,,,,S91392664,,,,,,Myiarchus crinitus,grcfly,Species,17334,,3,1,,,
351882251,Audio,Great Crested Flycatcher,Myiarchus crinitus,,,Kerri Angle,7/3/21,2021,7,3,750,United States,US-NC-183,North Carolina,Wake,Lake Raleigh,35.7667941,-78.6778808,,,Unspecified,FALSE,FALSE,,,,,,,S91169517,,,,Two great crested flycatchers talking to each other high up in the tree canopy.,Happened to stumble upon two talking to each other just above me in the forest treetops along the lake trail on the west side of the lake.  The other two I spotted were from the pedestrian bridge on the opposite side of the lake (where the lake trail splits off and continues under a tunnel).,Myiarchus crinitus,grcfly,Species,17334,,5,1,,,
350972221,Audio,Great Crested Flycatcher,Myiarchus crinitus,,,Kent Fiala,6/28/21,2021,6,28,721,United States,US-NC-093,North Carolina,Hoke,All American Trail (permanently closed 2022),35.0413445,-79.2330658,Adult – 2,Call,Not Used,,,,,Tascam DR-100MkIII,Sennheiser ME67/K6,,,S90926811,,,,,,Myiarchus crinitus,grcfly,Species,17334,,3.5,2,,,
349781061,Audio,Great Crested Flycatcher,Myiarchus crinitus,Thryothorus ludovicianus -- Carolina Wren; Cardinalis cardinalis -- Northern Cardinal; Dryocopus pileatus -- Pileated Woodpecker; Melospiza melodia -- Song Sparrow; Corvus brachyrhynchos -- American Crow; Passerina caerulea -- Blue Grosbeak,,Martin Wall,6/20/21,2021,6,20,711,United States,US-NC-157,North Carolina,Rockingham,Mebane Bridge Rd.,36.4731334,-79.7453356,Unknown – 1,Call,Not Used,,,,,iPhone SE,,,,S90485525,,,,mechanical noise 5-6 KHz,,Myiarchus crinitus,grcfly,Species,17334,,2,1,,,
348246801,Audio,Great Crested Flycatcher,Myiarchus crinitus,,,stephen pattee,6/16/21,2021,6,16,423,United States,US-NC-031,North Carolina,Carteret,Croatan NF - Millis Savanna FSR 154,34.7438378,-76.960233,,,Unspecified,FALSE,FALSE,,,,,,,S90284485,,,,,,Myiarchus crinitus,grcfly,Species,17334,,4.5,2,,,
347203291,Audio,Great Crested Flycatcher,Myiarchus crinitus,,,LynnErla Beegle,6/1/21,2021,6,1,625,United States,US-NC-183,North Carolina,Wake,"Foxwood Drive (Beegle's yard) (35.8893402, -78.6553067)",35.8893402,-78.6553067,,,Unspecified,FALSE,FALSE,,,,,,,S89407285,,,,,,Myiarchus crinitus,grcfly,Species,17334,,5,3,,,
345250161,Audio,Great Crested Flycatcher,Myiarchus crinitus,,,sheryl mcnair,6/4/21,2021,6,4,954,United States,US-NC-189,North Carolina,Watauga,*Moses Cone Memorial Park--Trout Lake,36.1560943,-81.6948938,,,Unspecified,FALSE,FALSE,,,,,,,S89596133,,,,,"On Flannery Fork rd, between horse pasture & 1st bridge. Closer to horse pasture. About 6 Breeps.",Myiarchus crinitus,grcfly,Species,17334,,2,1,,,
344410071,Audio,Great Crested Flycatcher,Myiarchus crinitus,,,Jared Evans,4/25/21,2021,4,25,1425,United States,US-NC-019,North Carolina,Brunswick,St James and Harbormaster,33.9339649,-78.1336418,,Call,Unspecified,,,,,iPhone 12,iPhone 12,RØDE Rec,,S89440748,,,,,,Myiarchus crinitus,grcfly,Species,17334,,4.5,2,,,
342775801,Audio,Great Crested Flycatcher,Myiarchus crinitus,,,Kent Fiala,5/27/21,2021,5,27,636,United States,US-NC-135,North Carolina,Orange,Efland SE--Mystic Lane (private),36.0037456,-79.1824412,Adult – 1,Call,Not Used,,,,,Tascam DR-100MkIII,Sennheiser ME67/K6,,,S89069580,,,,,,Myiarchus crinitus,grcfly,Species,17334,,3,1,,,
342274991,Audio,Great Crested Flycatcher,Myiarchus crinitus,,,Megan Carlton,4/23/21,2021,4,23,955,United States,US-NC-151,North Carolina,Randolph,"2617 Leo Lane, Asheboro US-NC (35.7739,-79.8021)",35.773894,-79.802088,,,Unspecified,FALSE,FALSE,,,,,,,S86153077,,,,,,Myiarchus crinitus,grcfly,Species,17334,,3,1,,,
342274961,Audio,Great Crested Flycatcher,Myiarchus crinitus,,,Megan Carlton,4/23/21,2021,4,23,955,United States,US-NC-151,North Carolina,Randolph,"2617 Leo Lane, Asheboro US-NC (35.7739,-79.8021)",35.773894,-79.802088,,,Unspecified,FALSE,FALSE,,,,,,,S86153077,,,,,,Myiarchus crinitus,grcfly,Species,17334,,3,1,,,
342262141,Audio,Great Crested Flycatcher,Myiarchus crinitus,,,Megan Carlton,5/20/21,2021,5,20,939,United States,US-NC-151,North Carolina,Randolph,"2617 Leo Ln, Asheboro US-NC 35.77412, -79.80212",35.774118,-79.802123,,,Unspecified,FALSE,FALSE,,,,,,,S88587359,,,,,,Myiarchus crinitus,grcfly,Species,17334,,1,1,,,
342045771,Audio,Great Crested Flycatcher,Myiarchus crinitus,,,Kent Fiala,5/24/21,2021,5,24,731,United States,US-NC-135,North Carolina,Orange,Brumley Nature Preserve--North,36.03391,-79.041909,Adult – 1,Call,Not Used,,,,,Tascam DR-100MkIII,Sennheiser ME67/K6,,,S88892002,,,,,,Myiarchus crinitus,grcfly,Species,17334,,3,2,,,
341482581,Audio,Great Crested Flycatcher,Myiarchus crinitus,,,Jay Wherley,5/23/21,2021,5,23,846,United States,US-NC-021,North Carolina,Buncombe,Biltmore Estate--The Lagoon,35.5402234,-82.5613117,,,Unspecified,FALSE,FALSE,,,,,,,S88810557,,,,,,Myiarchus crinitus,grcfly,Species,17334,,1,1,,,
340860261,Audio,Great Crested Flycatcher,Myiarchus crinitus,,,Marbry Hopkins,5/20/21,2021,5,20,846,United States,US-NC-067,North Carolina,Forsyth,Salem Lake--Linville Rd.,36.1060299,-80.1597691,,,Unspecified,FALSE,FALSE,,,,,,,S88591845,,,,,,Myiarchus crinitus,grcfly,Species,17334,,4.5,2,,,
340827581,Audio,Great Crested Flycatcher,Myiarchus crinitus,,,stephen pattee,5/21/21,2021,5,21,527,United States,US-NC-031,North Carolina,Carteret,"FSR 3017 off Bogue Loop Rd, Newport, North Carolina, US (34.716, -77.021)",34.7164793,-77.0210371,,,Unspecified,FALSE,FALSE,,,,,,,S88666094,,,,,,Myiarchus crinitus,grcfly,Species,17334,,5,2,,,
340209621,Audio,Great Crested Flycatcher,Myiarchus crinitus,Corvus ossifragus -- Fish Crow; Bombycilla cedrorum -- Cedar Waxwing,,Martin Wall,5/19/21,2021,5,19,645,United States,US-NC-157,North Carolina,Rockingham,Carolina Marina Boat Ramp,36.30387,-80.014005,,,Not Used,,,,,iPhone SE,,,,S88529044,,,,"Pair foraging and cavorting along wood's edge, maybe both birds vocalizing.",,Myiarchus crinitus,grcfly,Species,17334,,3,1,,,
339555741,Audio,Great Crested Flycatcher,Myiarchus crinitus,,,Steve Myers,5/17/21,2021,5,17,851,United States,US-NC-073,North Carolina,Gates,Merchants Millpond SP--Cypress Point & Coleman Trail,36.4313567,-76.6975482,,,Unspecified,FALSE,FALSE,,,,,,,S88400209,,,,,,Myiarchus crinitus,grcfly,Species,17334,,3,1,,,
338691031,Audio,Great Crested Flycatcher,Myiarchus crinitus,,,Joe and Liz Dunkleman,5/8/21,2021,5,8,555,United States,US-NC-045,North Carolina,Cleveland,Boiling Springs Backyard,35.2491947,-81.6778939,,,Unspecified,FALSE,FALSE,,,,,,,S87396844,,,,,,Myiarchus crinitus,grcfly,Species,17334,,3,1,,,
334688101,Audio,Great Crested Flycatcher,Myiarchus crinitus,,,stephen pattee,5/6/21,2021,5,6,1110,United States,US-NC-049,North Carolina,Craven,"FSR 147 Havelock, North Carolina, US (34.86, -76.804)",34.8602812,-76.8044823,,,Unspecified,FALSE,FALSE,,,,,,,S87277286,,,,,,Myiarchus crinitus,grcfly,Species,17334,,5,2,,,
333821801,Audio,Great Crested Flycatcher,Myiarchus crinitus,,,Kent Fiala,5/4/21,2021,5,4,722,United States,US-NC-135,North Carolina,Orange,Brumley Nature Preserve--North,36.03391,-79.041909,Adult – 1,Call; Song,Not Used,,,,,Tascam DR-100MkIII,Sennheiser ME67/K6,,,S87091850,,,,,,Myiarchus crinitus,grcfly,Species,17334,,2,1,,,
332875881,Audio,Great Crested Flycatcher,Myiarchus crinitus,Icteria virens -- Yellow-breasted Chat; Cardinalis cardinalis -- Northern Cardinal; Spizella pusilla -- Field Sparrow; Sayornis phoebe -- Eastern Phoebe,,Jay Wherley,5/2/21,2021,5,2,806,United States,US-NC-021,North Carolina,Buncombe,Sandy Mush Game Land--Norco Tract,35.7294789,-82.696305,,,Unspecified,FALSE,FALSE,,,,,,,S86911901,,,,,,Myiarchus crinitus,grcfly,Species,17334,,3,1,,,
331925121,Audio,Great Crested Flycatcher,Myiarchus crinitus,,,Jeremy Wrenn,4/28/21,2021,4,28,1924,United States,US-NC-183,North Carolina,Wake,E. Carroll Joyner Park,35.9980769,-78.5147595,,,Unspecified,FALSE,FALSE,,,,,,,S86612049,,,,,,Myiarchus crinitus,grcfly,Species,17334,,5,2,,,
331708541,Audio,Great Crested Flycatcher,Myiarchus crinitus,Contopus virens -- Eastern Wood-Pewee,,Kent Fiala,4/29/21,2021,4,29,621,United States,US-NC-135,North Carolina,Orange,Parker Preserve,35.880836,-79.035242,,Call; Song,Not Used,,,,,Tascam DR-100MkIII,Sennheiser ME 67/K6,,,S86644318,,,,,,Myiarchus crinitus,grcfly,Species,17334,,4.5,2,,,
331428071,Audio,Great Crested Flycatcher,Myiarchus crinitus,,,LynnErla Beegle,4/24/21,2021,4,24,612,United States,US-NC-019,North Carolina,Brunswick,Green Swamp Preserve,34.0890613,-78.2933807,Adult – 1,Call,Not Used,,,,,"Nikon CoolPix S7000, Mov to WAV by convertio.co",,,,S86216099,,,,Repeated chip notes,,Myiarchus crinitus,grcfly,Species,17334,,2,1,,,
329630811,Audio,Great Crested Flycatcher,Myiarchus crinitus,,,Thomas Sanders,4/24/21,2021,4,24,757,United States,US-NC-119,North Carolina,Mecklenburg,Briar Creek Greenway,35.219612,-80.795375,,,Unspecified,FALSE,FALSE,,,,,,,S86222239,,,,,,Myiarchus crinitus,grcfly,Species,17334,,2,1,,,
328815571,Audio,Great Crested Flycatcher,Myiarchus crinitus,,,LynnErla Beegle,4/20/21,2021,4,20,947,United States,US-NC-183,North Carolina,Wake,"NCBA Umstead SP,  Sals Branch Central Trail (35.881, -78.766)",35.8810322,-78.7656344,Adult – 1,Song,Not Used,,,,,Nikon CoolPix S7000 MOV to WAV with convertio.co,,,,S85960038,,,,Chatter without the agitated sounds that are so often heard by GCFL,,Myiarchus crinitus,grcfly,Species,17334,,3,1,,,
326606821,Audio,Great Crested Flycatcher,Myiarchus crinitus,,,Greg Hudson,4/15/21,2021,4,15,1000,United States,US-NC-139,North Carolina,Pasquotank,Fun Junktion Park,36.239467,-76.268092,,,Unspecified,FALSE,FALSE,,,,,,,S85600793,,,,"""Wheep"" call with two ""burry"" notes at the end.",,Myiarchus crinitus,grcfly,Species,17334,,3,2,,,
326111391,Audio,Great Crested Flycatcher,Myiarchus crinitus,,,Trevor Sleight,4/13/21,2021,4,13,713,United States,US-NC-041,North Carolina,Chowan,Bennett Mill Pond,36.1400235,-76.6650009,,,Not Used,,,,,Iphone 12 Pro,RODE Videomic Me,,,S85460595,,,,,,Myiarchus crinitus,grcfly,Species,17334,,3,1,,,
284298991,Audio,Great Crested Flycatcher,Myiarchus crinitus,,,Martina Nordstrand,8/29/20,2020,8,29,1107,United States,US-NC-055,North Carolina,Dare,Alligator River NWR--Sawyer Lake Rd.,35.8475958,-75.8712387,,Call,Unspecified,,,,,,,,,S72943920,,,,,,Myiarchus crinitus,grcfly,Species,17334,,4,2,,,
270642721,Audio,Great Crested Flycatcher,Myiarchus crinitus,Poecile carolinensis -- Carolina Chickadee,,Martin Wall,9/5/20,2020,9,5,701,United States,US-NC-157,North Carolina,Rockingham,Mayo River SP--Tyne Rd. Tract,36.5067195,-80.0016891,Unknown – 1,Call,Unspecified,,,,,iPhone SE,,,,S73209007,,,,,,Myiarchus crinitus,grcfly,Species,17334,,2,1,,,
262640931,Audio,Great Crested Flycatcher,Myiarchus crinitus,,,Stephen Schoon,9/12/20,2020,9,12,1406,United States,US-NC-025,North Carolina,Cabarrus,Buffalo Creek Preserve,35.3787173,-80.4361331,,,Unspecified,FALSE,FALSE,,,,,,,S73534976,,,,,,Myiarchus crinitus,grcfly,Species,17334,,4.5,2,,,
260022911,Audio,Great Crested Flycatcher,Myiarchus crinitus,,,Martin Wall,8/30/20,2020,8,30,621,United States,US-NC-157,North Carolina,Rockingham,Dan River Game Land--Riverside Circle,36.449966,-79.806103,,Call,Not Used,,,,,iPhone SE,,,,S73106964,,,,,,Myiarchus crinitus,grcfly,Species,17334,,2,1,,,
255721201,Audio,Great Crested Flycatcher,Myiarchus crinitus,,,Valinor Mullins,8/15/20,2020,8,15,913,United States,US-NC-081,North Carolina,Guilford,1600 oak st,36.0554862,-79.817007,,,Unspecified,FALSE,FALSE,,,,,,,S72425890,,,,,,Myiarchus crinitus,grcfly,Species,17334,,1,1,,,
255378361,Audio,Great Crested Flycatcher,Myiarchus crinitus,,,Steven Howell,8/11/20,2020,8,11,836,United States,US-NC-031,North Carolina,Carteret,"2728 Myrtle St, Morehead City US-NC 34.72951, -76.73956",34.729514,-76.739556,,,Unspecified,FALSE,FALSE,,,,,,,S72310628,,,,,,Myiarchus crinitus,grcfly,Species,17334,,0,0,,,
254205071,Audio,Great Crested Flycatcher,Myiarchus crinitus,Corvus ossifragus -- Fish Crow,,Rob Bierregaard,4/18/09,2009,4,18,600,United States,US-NC-129,North Carolina,New Hanover,Carolina Beach State Park,34.0499847,-77.9176247,Adult – 1,Call,Not Used,,,,,Tascam HD-P2,Sennheiser ME66,,,S72200221,,,,,,Myiarchus crinitus,grcfly,Species,17334,,3,1,,,
254127501,Audio,Great Crested Flycatcher,Myiarchus crinitus,,,Rob Bierregaard,4/18/09,2009,4,18,600,United States,US-NC-129,North Carolina,New Hanover,Carolina Beach State Park,34.0499847,-77.9176247,Adult – 2,Call,Used,,,,,Tascam HD-P2,Sennheiser ME66,,,S72200221,,,,All agitated response to playback of own song,,Myiarchus crinitus,grcfly,Species,17334,,3.5,2,,,
252037651,Audio,Great Crested Flycatcher,Myiarchus crinitus,,,Arch  McCallum,5/2/09,2009,5,2,515,United States,US-NC-047,North Carolina,Columbus,Lumber River SP,34.418428,-78.9710999,Adult – 2,Dawn Song,Not Used,,,,,Sony TCD5 Pro II,Sennheiser ME62/K6,Telinga 22 in parabola,,S55988000,,,,"This cut has a call-type not presented in Pieplow, but it appears homologous with Brown-crested dawnsong","From dock. Two birds dawnsinging, one across the river. Unusual song-types here are similar structurally to elements of dawnsong of Brown-crested, although clearly different.",Myiarchus crinitus,grcfly,Species,17334,,2,1,,,
248279511,Audio,Great Crested Flycatcher,Myiarchus crinitus,,,Fleeta Chauvigne,7/8/20,2020,7,8,952,United States,US-NC-135,North Carolina,Orange,Occoneechee Mt. State Natural Area,36.0634972,-79.1147804,,,Unspecified,FALSE,FALSE,,,,,,,S71261744,,,,,One juvenile,Myiarchus crinitus,grcfly,Species,17334,,1,1,,,
247418551,Audio,Great Crested Flycatcher,Myiarchus crinitus,,,Martin Wall,7/4/20,2020,7,4,649,United States,US-NC-031,North Carolina,Carteret,Fort Macon SP,34.7032354,-76.6983032,,,Not Used,,,,,iPhone 5s,,,,S71115599,,,,,,Myiarchus crinitus,grcfly,Species,17334,,2,1,,,
240810801,Audio,Great Crested Flycatcher,Myiarchus crinitus,,,Paul Beerman,6/3/20,2020,6,3,751,United States,US-NC-067,North Carolina,Forsyth,Tanglewood Park,36.016407,-80.4116821,,,Unspecified,FALSE,FALSE,,,,,,,S70006559,,,,,,Myiarchus crinitus,grcfly,Species,17334,,3,1,,,
238451971,Audio,Great Crested Flycatcher,Myiarchus crinitus,,,Jay Wherley,5/24/20,2020,5,24,1028,United States,US-NC-199,North Carolina,Yancey,"Pisgah National Forest, Green Mountain US-NC 36.04998, -82.36787",36.049981,-82.367866,,,Unspecified,FALSE,FALSE,,,,,,,S69588415,,,,,,Myiarchus crinitus,grcfly,Species,17334,,3,1,,,
236711621,Audio,Great Crested Flycatcher,Myiarchus crinitus,,,Kent Fiala,5/18/20,2020,5,18,1502,United States,US-NC-135,North Carolina,Orange,Borland Road (Home),36.0044975,-79.1378184,Adult – 1,Song,Not Used,,,,,Samsung Galaxy S9+,,,,S69278922,,,,,,Myiarchus crinitus,grcfly,Species,17334,,3,1,,,
236138591,Audio,Great Crested Flycatcher,Myiarchus crinitus,,,LynnErla Beegle,5/14/20,2020,5,14,905,United States,US-NC-183,North Carolina,Wake,Crabtree Creek Wetland--West of Raleigh Blvd.,35.8068028,-78.6070436,,,Unspecified,FALSE,FALSE,,,,,,,S69027399,,,,,,Myiarchus crinitus,grcfly,Species,17334,,3,1,,,
234954281,Audio,Great Crested Flycatcher,Myiarchus crinitus,,,stephen pattee,5/15/20,2020,5,15,653,United States,US-NC-061,North Carolina,Duplin,"Angola Game Land, Wallace, North Carolina, US (34.76, -77.833)",34.7595759,-77.8332572,,,Unspecified,FALSE,FALSE,,,,,,,S69096351,,,,,,Myiarchus crinitus,grcfly,Species,17334,,2,1,,,
232015971,Audio,Great Crested Flycatcher,Myiarchus crinitus,,,stephen pattee,5/8/20,2020,5,8,522,United States,US-NC-141,North Carolina,Pender,"Holly Shelter Game Land--Lodge Rd, WMA",34.5285507,-77.7418327,,,Unspecified,FALSE,FALSE,,,,,,,S68613590,,,,,,Myiarchus crinitus,grcfly,Species,17334,,3.5,2,,,
231574461,Audio,Great Crested Flycatcher,Myiarchus crinitus,,,Steven Howell,5/7/20,2020,5,7,612,United States,US-NC-031,North Carolina,Carteret,"Croatan National Forest, Newport US-NC 34.76725, -76.86742",34.767251,-76.867423,,,Unspecified,FALSE,FALSE,,,,,,,S68534153,,,,,,Myiarchus crinitus,grcfly,Species,17334,,2.5,2,,,
231413271,Audio,Great Crested Flycatcher,Myiarchus crinitus,,,Caleb Bronsink,5/6/20,2020,5,6,1729,United States,US-NC-147,North Carolina,Pitt,Back yard (private),35.3870995,-77.2898,,,Unspecified,FALSE,FALSE,,,,,,,S68515640,,,,,,Myiarchus crinitus,grcfly,Species,17334,,2.67,3,,,
230038171,Audio,Great Crested Flycatcher,Myiarchus crinitus,,,Miles Buddy,5/2/20,2020,5,2,704,United States,US-NC-021,North Carolina,Buncombe,Sandy Mush Game Land--Bear Creek Access,35.7277016,-82.7044773,,,Unspecified,FALSE,FALSE,,,,,,,S68235196,,,,,,Myiarchus crinitus,grcfly,Species,17334,,4,2,,,
230021691,Audio,Great Crested Flycatcher,Myiarchus crinitus,,,Paula Caycedo,5/3/20,2020,5,3,815,United States,US-NC-173,North Carolina,Swain,"35°23'07.4""N 83°34'45.4""W",35.3855233,-83.5792084,,Call,Not Used,,,,,Marantz PMD 661,Senheizer MKH20,Parabola Telinga Pro,,S68303467,,,,,,Myiarchus crinitus,grcfly,Species,17334,,2.5,2,,,
229637501,Audio,Great Crested Flycatcher,Myiarchus crinitus,Setophaga citrina -- Hooded Warbler,,Seth Buddy,5/2/20,2020,5,2,704,United States,US-NC-021,North Carolina,Buncombe,Sandy Mush Game Land--Bear Creek Access,35.7277016,-82.7044773,Adult Male – 1,,Not Used,,,,,Tascam-100MKIII,Wildtronics Pro Mono,"Wildtronics 22"" parabola; windscreen",,S68235194,,,,GCFL was approx 10 meters off the trail in young mixed hardwood forest.,,Myiarchus crinitus,grcfly,Species,17334,,2,1,,,
229612141,Audio,Great Crested Flycatcher,Myiarchus crinitus,,,stephen pattee,5/2/20,2020,5,2,801,United States,US-NC-141,North Carolina,Pender,"Driftwood Dr., Hampstead, NC",34.4341658,-77.5640631,,,Unspecified,FALSE,FALSE,,,,,,,S68239523,,,,,,Myiarchus crinitus,grcfly,Species,17334,,3.67,3,,,
228972761,Audio,Great Crested Flycatcher,Myiarchus crinitus,,,David Disher,4/30/20,2020,4,30,1024,United States,US-NC-067,North Carolina,Forsyth,Miller Park,36.0862513,-80.2836013,,Call,Not Used,,,,,Samsung S7 Cell Phone,None,None,,S68101760,,,,,,Myiarchus crinitus,grcfly,Species,17334,,3,1,,,
227918811,Audio,Great Crested Flycatcher,Myiarchus crinitus,,,Guy McGrane,4/26/20,2020,4,26,1200,United States,US-NC-193,North Carolina,Wilkes,Yadkin River Greenway--Mulberry Fields,36.1527028,-81.1509204,,,Unspecified,FALSE,FALSE,,,,,,,S67866582,,,,,"heard only, near parking lot in wilkesboro",Myiarchus crinitus,grcfly,Species,17334,,1,1,,,
227806451,Audio,Great Crested Flycatcher,Myiarchus crinitus,,,Aaron Edmonds,4/20/20,2020,4,20,1500,United States,US-NC-085,North Carolina,Harnett,River Field,35.3338183,-78.9342787,,,Unspecified,FALSE,FALSE,,,,,,,S67559056,,,,,,Myiarchus crinitus,grcfly,Species,17334,,3,3,,,
227221051,Audio,Great Crested Flycatcher,Myiarchus crinitus,,,Al Hooks,4/25/20,2020,4,25,1414,United States,US-NC-055,North Carolina,Dare,Kitty Hawk Woods Coastal Reserve--Ridge Rd. Access,36.0757622,-75.7353374,,,Unspecified,FALSE,FALSE,,,,,,,S67800573,,,,,,Myiarchus crinitus,grcfly,Species,17334,,3,1,,,
225877481,Audio,Great Crested Flycatcher,Myiarchus crinitus,,,Chip Davis,4/21/20,2020,4,21,642,United States,US-NC-125,North Carolina,Moore,Weymouth Woods Sandhills Nature Preserve,35.1471875,-79.3689895,,,Unspecified,FALSE,FALSE,,,,,,,S67589845,,,,,,Myiarchus crinitus,grcfly,Species,17334,,4,2,,,
225465211,Audio,Great Crested Flycatcher,Myiarchus crinitus,,,Joe Donahue,4/19/20,2020,4,19,724,United States,US-NC-063,North Carolina,Durham,Sandy Creek Park,35.9681599,-78.9675164,,,Unspecified,FALSE,FALSE,,,,,,,S67464483,,,,,,Myiarchus crinitus,grcfly,Species,17334,,3,1,,,
224454111,Audio,Great Crested Flycatcher,Myiarchus crinitus,,,stephen pattee,4/17/20,2020,4,17,453,United States,US-NC-141,North Carolina,Pender,Holly Shelter Game Land--Lodge Rd. Central,34.4113,-77.6717091,,,Unspecified,FALSE,FALSE,,,,,,,S67367294,,,,,,Myiarchus crinitus,grcfly,Species,17334,,3.5,2,,,
221209041,Audio,Great Crested Flycatcher,Myiarchus crinitus,Thryothorus ludovicianus -- Carolina Wren; Corvus ossifragus -- Fish Crow; Zenaida macroura -- Mourning Dove; Agelaius phoeniceus -- Red-winged Blackbird,,Don Bemont,4/6/20,2020,4,6,730,United States,US-NC-055,North Carolina,Dare,Kitty Hawk Woods Coastal Reserve,36.0870775,-75.73409,Adult – 1,Call,Not Used,,,,,Roland R26,Audio-Technica AT8015,,,S66710668,,,,,,Myiarchus crinitus,grcfly,Species,17334,,2,1,,,
219973881,Audio,Great Crested Flycatcher,Myiarchus crinitus,,,Will Taber,4/1/20,2020,4,1,1520,United States,US-NC-141,North Carolina,Pender,Poplar Grove Plantation,34.3207198,-77.7654791,,,Unspecified,FALSE,FALSE,,,,,,,S66518071,,,,,"Heard distinct weep call loud and clear, never visually confirmed. Will attach recording ASAP.",Myiarchus crinitus,grcfly,Species,17334,,2,1,,,
175424981,Audio,Great Crested Flycatcher,Myiarchus crinitus,,,Christine Stoughton Root,9/1/19,2019,9,1,614,United States,US-NC-049,North Carolina,Craven,Croatan NF--National Forest Rd from Perrytown Rd to County Line Rd,35.0460895,-77.0675468,,,Unspecified,FALSE,FALSE,,,,,,,S59422222,,,,,,Myiarchus crinitus,grcfly,Species,17334,,3,2,,,
170959241,Audio,Great Crested Flycatcher,Myiarchus crinitus,,,Martin Wall,5/18/19,2019,5,18,637,United States,US-NC-031,North Carolina,Carteret,Coastal Community Market (Historic),34.717871,-76.661491,Adult,Call,Not Used,,,,,iPhone 5s,,,,S56441070,,,,,,Myiarchus crinitus,grcfly,Species,17334,,3.5,2,,,
168452771,Audio,Great Crested Flycatcher,Myiarchus crinitus,,,Kent Fiala,7/16/19,2019,7,16,1012,United States,US-NC-135,North Carolina,Orange,Borland Road (Home),36.0044975,-79.1378184,Unknown,Call,Not Used,,,,,Samsung Galaxy S9+,,,,S58224367,,,,,,Myiarchus crinitus,grcfly,Species,17334,,3,1,,,
167560511,Audio,Great Crested Flycatcher,Myiarchus crinitus,,,Kent Fiala,7/9/19,2019,7,9,956,United States,US-NC-135,North Carolina,Orange,Borland Road (Home),36.0044975,-79.1378184,Adult,Call,Not Used,,,,,Samsung Galaxy S9+,,,,S58049937,,,,,,Myiarchus crinitus,grcfly,Species,17334,,2.5,2,,,
166003421,Audio,Great Crested Flycatcher,Myiarchus crinitus,,,Kent Fiala,6/27/19,2019,6,27,742,United States,US-NC-135,North Carolina,Orange,Borland Road (Home),36.0044975,-79.1378184,Adult,Call,Not Used,,,,,Samsung Galaxy S9+,,,,S57728793,,,,,,Myiarchus crinitus,grcfly,Species,17334,,3,1,,,
164257921,Audio,Great Crested Flycatcher,Myiarchus crinitus,,,Martin Wall,6/15/19,2019,6,15,638,United States,US-NC-157,North Carolina,Rockingham,Mebane Bridge Rd.,36.4731334,-79.7453356,Unknown,Call,Not Used,,,,,iPhone 5s,,,,S57388960,,,,,,Myiarchus crinitus,grcfly,Species,17334,,4.5,2,,,
161186241,Audio,Great Crested Flycatcher,Myiarchus crinitus,,,Steve Semanchuk,5/27/19,2019,5,27,950,United States,US-NC-021,North Carolina,Buncombe,40 Flack Valley Road,35.7096008,-82.6052141,Adult,Song,Not Used,,,,,iPhone 6s,,,,S56792373,,,,Second flycatcher can be heard in the background.  Nest box for this species erected this year as the GCFL has been regular here the past several breeding seasons.,,Myiarchus crinitus,grcfly,Species,17334,,3,2,,,
158916821,Audio,Great Crested Flycatcher,Myiarchus crinitus,,,Martin Wall,5/16/19,2019,5,16,855,United States,US-NC-031,North Carolina,Carteret,"3400–3566 Cedar Island Rd, Cedar Island US-NC (35.0163,-76.3167)",35.016307,-76.316665,Adult,Call,Not Used,,,,,iPhone 5s,,,,S56347762,,,,two birds interacting; don't know if it was mating behavior or territorial bickering,,Myiarchus crinitus,grcfly,Species,17334,,3.33,3,,,
158056771,Audio,Great Crested Flycatcher,Myiarchus crinitus,,,Thomas Sanders,5/12/19,2019,5,12,1123,United States,US-NC-119,North Carolina,Mecklenburg,Latta Park,35.2082139,-80.8476162,Adult,Song,Not Used,,,,,iPhone 7,,,,S56185312,,,,,,Myiarchus crinitus,grcfly,Species,17334,,4,2,,,
155654901,Audio,Great Crested Flycatcher,Myiarchus crinitus,,,Martin Wall,5/3/19,2019,5,3,708,United States,US-NC-157,North Carolina,Rockingham,Idol Park,36.3796702,-79.9794844,Adult,Call,Not Used,,,,,Zoom H1,,,,S55709393,,,,,,Myiarchus crinitus,grcfly,Species,17334,,3,2,,,
155501431,Audio,Great Crested Flycatcher,Myiarchus crinitus,,,Ken Kneidel,4/29/19,2019,4,29,727,United States,US-NC-119,North Carolina,Mecklenburg,Briar Creek Greenway/Eastover Park,35.1986695,-80.8124792,,Song,Unspecified,,,,,,,,,S55549065,,,,,,Myiarchus crinitus,grcfly,Species,17334,,3.5,2,,,
154701231,Audio,Great Crested Flycatcher,Myiarchus crinitus,,,LynnErla Beegle,4/27/19,2019,4,27,625,United States,US-NC-019,North Carolina,Brunswick,Green Swamp Preserve,34.0890613,-78.2933807,,Call; Song,Not Used,,,,,Nikon CoolPix S7000 - MOV to WAV using www.convertio.co,,,,S55457623,,,,Recorded at 6:59 AM EDT,"Very noisy birds, with four calling back and forth and interacting",Myiarchus crinitus,grcfly,Species,17334,,3,1,,,
154701211,Audio,Great Crested Flycatcher,Myiarchus crinitus,,,LynnErla Beegle,4/27/19,2019,4,27,625,United States,US-NC-019,North Carolina,Brunswick,Green Swamp Preserve,34.0890613,-78.2933807,,Call; Song,Not Used,,,,,Nikon CoolPix S7000 - MOV to WAV using www.convertio.co,,,,S55457623,,,,"Recorded at 7:05 AM EDT. These two GCFL are countersinging with one starting just a split-second before the other one - sounds like an aggressive challenge, rather than bonding.","Very noisy birds, with four calling back and forth and interacting",Myiarchus crinitus,grcfly,Species,17334,,3.5,2,,,
116155721,Audio,Great Crested Flycatcher,Myiarchus crinitus,,,Shelley Rutkin,9/24/18,2018,9,24,1820,United States,US-NC-067,North Carolina,Forsyth,Mallard Lakes,36.189292,-80.3225522,,,Not Used,,,,,iPhone 6 Plus,None,None,,S48725653,,,,Recorded with Song Sleuth and edited with Audacity,,Myiarchus crinitus,grcfly,Species,17334,,3,2,,,
112635211,Audio,Great Crested Flycatcher,Myiarchus crinitus,,,Christine Stoughton Root,8/28/18,2018,8,28,631,United States,US-NC-137,North Carolina,Pamlico,Schooner Landing Merritt NC,35.1344813,-76.6956532,Adult Male,Call,Not Used,,,,,H4nProZoom,na,na,,S48124895,,,,,,Myiarchus crinitus,grcfly,Species,17334,,3.5,2,,,
108108881,Audio,Great Crested Flycatcher,Myiarchus crinitus,,,Robert Bochenek,7/7/18,2018,7,7,945,United States,US-NC-177,North Carolina,Tyrrell,Palmetto Peartree Preserve,35.9827292,-76.1201477,Adult,Call; Song,Not Used,,,,,Olympus WS-822,Audio-Technica ATR 6550 Shotgun,,,S47048385,,,,,,Myiarchus crinitus,grcfly,Species,17334,,1.5,2,,,
102476921,Audio,Great Crested Flycatcher,Myiarchus crinitus,,,Jonathan Lugo,5/28/18,2018,5,28,1158,United States,US-NC-053,North Carolina,Currituck,Endless Sunset Beach House,36.288287,-75.804816,,,Not Used,,,,,Zoom H2,Rhode VideoMic,,,S46102866,,,,,Recording later.,Myiarchus crinitus,grcfly,Species,17334,,4,2,,,
101076811,Audio,Great Crested Flycatcher,Myiarchus crinitus,,,Aaron Steed,5/7/18,2018,5,7,1025,United States,US-NC-021,North Carolina,Buncombe,Lake Powhatan,35.4824091,-82.6256418,Adult,Call,Not Used,,,,,,,,,S45420772,,,,,,Myiarchus crinitus,grcfly,Species,17334,,2,2,,,
101076801,Audio,Great Crested Flycatcher,Myiarchus crinitus,,,Aaron Steed,5/7/18,2018,5,7,1025,United States,US-NC-021,North Carolina,Buncombe,Lake Powhatan,35.4824091,-82.6256418,Adult,Call,Not Used,,,,,,,,,S45420772,,,,,,Myiarchus crinitus,grcfly,Species,17334,,3.5,2,,,
100696461,Audio,Great Crested Flycatcher,Myiarchus crinitus,,,Guy McGrane,5/17/18,2018,5,17,1500,United States,US-NC-189,North Carolina,Watauga,Hickory Knoll,36.2178429,-81.5051436,,,Unspecified,FALSE,FALSE,,,,,,,S45772334,,,,,"These are quite uncommon in the county so I was very surprised to hear what sounded like one calling in the backyard. I went out to chase it down and it was in the grove of tall oak trees in the back yard, flying out to catch bugs and then back into the trees. I was able to get a definitive look at a yellowish bellied and brown topped bird with a fluffy crest, but only for a few seconds. Interestingly, this bird is 2 years to the day after my last in-county sighting and at the same place too. Gave the strong clear rising sheeep call, but only a few times.",Myiarchus crinitus,grcfly,Species,17334,,3.33,3,,,
100609041,Audio,Great Crested Flycatcher,Myiarchus crinitus,,,LynnErla Beegle,5/17/18,2018,5,17,527,United States,US-NC-183,North Carolina,Wake,"Foxwood Drive (Beegle's yard) (35.8893402, -78.6553067)",35.8893402,-78.6553067,Unknown,Call,Not Used,,,,,Nikon CoolPix S7000 - MOV file converted to mp3,,,,S45758562,,,,"Early morning call of a GCFL. Did not respond to playback. Easier to hear than ML100609031 (same bird) but background noises include a distant car, two footsteps, and a birdfeeder swinging and banging (flying-squirrel interference).",Odd call that I've never heard before from a GCFL.,Myiarchus crinitus,grcfly,Species,17334,,3.5,2,,,
100609031,Audio,Great Crested Flycatcher,Myiarchus crinitus,,,LynnErla Beegle,5/17/18,2018,5,17,527,United States,US-NC-183,North Carolina,Wake,"Foxwood Drive (Beegle's yard) (35.8893402, -78.6553067)",35.8893402,-78.6553067,Unknown,Call,Not Used,,,,,Nikon CoolPix S7000 - MOV file converted to mp3,,,,S45758562,,,,"Early morning call of a GCFL. Did not respond to playback. This one has more interference from background sounds of AMRO, etc. than the ML100609041 recording. Same bird in both recordings.",Odd call that I've never heard before from a GCFL.,Myiarchus crinitus,grcfly,Species,17334,,3,2,,,
99726091,Audio,Great Crested Flycatcher,Myiarchus crinitus,,,Charlie Bruggemann,5/11/18,2018,5,11,650,United States,US-NC-053,North Carolina,Currituck,"Mackay Island National Wildlife Refuge, Knotts Island US-NC (36.5126,-75.9531)",36.512559,-75.95311,,,Unspecified,FALSE,FALSE,,,,,,,S45549499,,,,,,Myiarchus crinitus,grcfly,Species,17334,,3,2,,,
99673861,Audio,Great Crested Flycatcher,Myiarchus crinitus,,,Matt Wangerin,5/11/18,2018,5,11,1655,United States,US-NC-081,North Carolina,Guilford,"Reedy Fork Trail, Greensboro",36.174538,-79.812781,,Call,Not Used,,,,,iPhone 6 video converted to wav,,,,S45571015,,,,,,Myiarchus crinitus,grcfly,Species,17334,,3,2,,,
97666501,Audio,Great Crested Flycatcher,Myiarchus crinitus,,,Nate Swick,5/2/18,2018,5,2,830,United States,US-NC-081,North Carolina,Guilford,Hamilton Lakes Park,36.0849161,-79.8632884,,Call,Not Used,,,,,Zoom H4n Pro,,,,S45171397,,,,,,Myiarchus crinitus,grcfly,Species,17334,,3.5,2,,,
96991551,Audio,Great Crested Flycatcher,Myiarchus crinitus,,,Miles Buddy,4/28/18,2018,4,28,1746,United States,US-NC-021,North Carolina,Buncombe,Sandy Mush Game Land--Bear Creek Access,35.7277016,-82.7044773,Unknown,Song,Not Used,,,,,Roland R-05,Sennheiser ME66,"headphones, shock mount",,S45045713,,,,,,Myiarchus crinitus,grcfly,Species,17334,,3.5,2,,,
96710681,Audio,Great Crested Flycatcher,Myiarchus crinitus,,,Charlie Bruggemann,4/26/18,2018,4,26,710,United States,US-NC-053,North Carolina,Currituck,"Knotts Island, NC  27950, Knotts Island US-NC (36.5129,-75.9330)",36.51294,-75.933014,,,Not Used,,,,,Zoom H4n Pro,,,,S44960795,,,,,Three birds were having a territorial dispute flaring their crests and calling.,Myiarchus crinitus,grcfly,Species,17334,,3.5,2,,,
96710661,Audio,Great Crested Flycatcher,Myiarchus crinitus,,,Charlie Bruggemann,4/26/18,2018,4,26,710,United States,US-NC-053,North Carolina,Currituck,"Knotts Island, NC  27950, Knotts Island US-NC (36.5129,-75.9330)",36.51294,-75.933014,,,Not Used,,,,,Zoom H4n Pro,,,,S44960795,,,,,Three birds were having a territorial dispute flaring their crests and calling.,Myiarchus crinitus,grcfly,Species,17334,,4.5,2,,,
96430541,Audio,Great Crested Flycatcher,Myiarchus crinitus,,,LynnErla Beegle,4/25/18,2018,4,25,712,United States,US-NC-183,North Carolina,Wake,Lake Lynn,35.8820127,-78.7001324,Adult,Call,Not Used,,,,,Nikon Coolpix S7000 - converted MOV to MP3 with software,,,,S44923737,,,,Two GCFL interacting over the Glenharden entrance to Lake Lynn,,Myiarchus crinitus,grcfly,Species,17334,,3,2,,,
96272761,Audio,Great Crested Flycatcher,Myiarchus crinitus,,,John Koon,4/24/18,2018,4,24,1100,United States,US-NC-021,North Carolina,Buncombe,Biltmore Estate--The Lagoon,35.5402234,-82.5613117,,Call,Not Used,,,,,iPhone 5,,,,S44902635,,,,,,Myiarchus crinitus,grcfly,Species,17334,,4,2,,,
94455491,Audio,Great Crested Flycatcher,Myiarchus crinitus,,,Martin Wall,4/13/18,2018,4,13,859,United States,US-NC-031,North Carolina,Carteret,Croatan NF--Pringle Road,34.7387207,-76.9908142,Adult Male,Call; Song,Not Used,,,,,iPhone 5s,,,,S44523403,,,,,,Myiarchus crinitus,grcfly,Species,17334,,3,2,,,
63107161,Audio,Great Crested Flycatcher,Myiarchus crinitus,,,Steve Semanchuk,7/11/17,2017,7,11,712,United States,US-NC-021,North Carolina,Buncombe,40 Flack Valley Road,35.7096008,-82.6052141,Adult,Call,Not Used,,,,,iPHone 6,,,,S38082184,,,,One bird calling intermittently throughout most of the morning,,Myiarchus crinitus,grcfly,Species,17334,,4,3,,,
60053331,Audio,Great Crested Flycatcher,Myiarchus crinitus,,,Marbry Hopkins,6/2/17,2017,6,2,1120,United States,US-NC-031,North Carolina,Carteret,Croatan NF--Millis Rd. Savanna,34.7661532,-76.9556236,Adult Male,Song,Not Used,,,,,iPhone 6,Comica CVM-VS08,Song Sleuth App,,S37333991,,,,,,Myiarchus crinitus,grcfly,Species,17334,,2,2,,,
59157351,Audio,Great Crested Flycatcher,Myiarchus crinitus,,,Jay Wherley,5/24/17,2017,5,24,800,United States,US-NC-021,North Carolina,Buncombe,Beaver Lake Bird Sanctuary,35.633465,-82.55752,,Call,Used,,,,,iphone SE,,,,S37109950,,,,"Calls at 4,8,13,20 seconds",,Myiarchus crinitus,grcfly,Species,17334,,3,2,,,
56846051,Audio,Great Crested Flycatcher,Myiarchus crinitus,,,Martin Wall,5/1/17,2017,5,1,639,United States,US-NC-031,North Carolina,Carteret,Cape Lookout NS--Core Sound Waterfowl Museum Trails,34.6864399,-76.527586,Adult,Call,Not Used,,,,,iPhone 5s,,,,S36448458,,,,,,Myiarchus crinitus,grcfly,Species,17334,,5,2,,,
55397481,Audio,Great Crested Flycatcher,Myiarchus crinitus,,,Mike Stewart 🦅,4/22/17,2017,4,22,1740,United States,US-NC-051,North Carolina,Cumberland,Smith Lake,35.1330429,-78.9213738,,,Unspecified,FALSE,FALSE,,,,,,,S36182428,,,,,,Myiarchus crinitus,grcfly,Species,17334,,3.67,3,,,
54435591,Audio,Great Crested Flycatcher,Myiarchus crinitus,,,Martin Wall,4/13/17,2017,4,13,723,United States,US-NC-031,North Carolina,Carteret,Croatan NF--Millis Rd. Savanna,34.7661532,-76.9556236,,Call,Not Used,,,,,iPhone 5s,,,,S35917269,,,,,,Myiarchus crinitus,grcfly,Species,17334,,2.5,2,,,
53674461,Audio,Great Crested Flycatcher,Myiarchus crinitus,,,Don Bemont,4/7/17,2017,4,7,630,United States,US-NC-055,North Carolina,Dare,Alligator River NWR--Buffalo City Rd.,35.8663085,-75.9186709,,Call,Not Used,,,,,Roland R26,Audio-Technica AT8015,,,S35759930,,,,,First I have found this spring,Myiarchus crinitus,grcfly,Species,17334,,3,2,,,
53607051,Audio,Great Crested Flycatcher,Myiarchus crinitus,,,Martin Wall,4/6/17,2017,4,6,859,United States,US-NC-031,North Carolina,Carteret,Forest Service Road 169,34.8353813,-76.786682,,Call,Not Used,,,,,iPhone 5s,,,,S35735550,,,,,,Myiarchus crinitus,grcfly,Species,17334,,4.5,2,,,
38657051,Audio,Great Crested Flycatcher,Myiarchus crinitus,,,Samuel West,9/16/16,2016,9,16,700,United States,US-NC-199,North Carolina,Yancey,Blue Ridge Pkwy--Ridge Junction (Yancey Co.),35.7172493,-82.2773838,,,Unspecified,FALSE,FALSE,,,,,,,S31629230,,,,,heard only,Myiarchus crinitus,grcfly,Species,17334,,2.5,2,,,
33782691,Audio,Great Crested Flycatcher,Myiarchus crinitus,,,Mike Stewart 🦅,8/31/16,2016,8,31,1805,United States,US-NC-085,North Carolina,Harnett,Anderson Creek Park,35.3162076,-78.9614332,,,Unspecified,FALSE,FALSE,,,,,,,S31350278,,,,,,Myiarchus crinitus,grcfly,Species,17334,,2.5,2,,,
33782681,Audio,Great Crested Flycatcher,Myiarchus crinitus,,,Mike Stewart 🦅,8/31/16,2016,8,31,1805,United States,US-NC-085,North Carolina,Harnett,Anderson Creek Park,35.3162076,-78.9614332,,,Unspecified,FALSE,FALSE,,,,,,,S31350278,,,,,,Myiarchus crinitus,grcfly,Species,17334,,2.5,2,,,
33623081,Audio,Great Crested Flycatcher,Myiarchus crinitus,,,Mike Stewart 🦅,8/29/16,2016,8,29,1730,United States,US-NC-051,North Carolina,Cumberland,Carvers Creek SP--Long Valley Farm,35.2064291,-78.9777153,,,Unspecified,FALSE,FALSE,,,,,,,S31320253,,,,,,Myiarchus crinitus,grcfly,Species,17334,,2.5,2,,,
27394141,Audio,Great Crested Flycatcher,Myiarchus crinitus,,,Martin Wall,4/15/16,2016,4,15,744,United States,US-NC-031,North Carolina,Carteret,Carteret - Croatan NF - Millis Rd west end,34.7479892,-77.0255544,Adult,Call,Not Used,,,,,iPhone 5s,Azden SMX-10,Rode Red App & Audacity Software,,S28957836,,,,,,Myiarchus crinitus,grcfly,Species,17334,,2.5,2,,,
27101731,Audio,Great Crested Flycatcher,Myiarchus crinitus,,,Don Bemont,4/15/16,2016,4,15,740,United States,US-NC-055,North Carolina,Dare,Kitty Hawk Woods Coastal Reserve--Ridge Rd. Access,36.0757622,-75.7353374,,,Unspecified,FALSE,FALSE,,,,,,,S28963346,,,,,,Myiarchus crinitus,grcfly,Species,17334,,2,2,,,
26970951,Audio,Great Crested Flycatcher,Myiarchus crinitus,,,Don Bemont,4/12/16,2016,4,12,645,United States,US-NC-055,North Carolina,Dare,Kitty Hawk Woods Coastal Reserve--Ridge Rd. Access,36.0757622,-75.7353374,,,Unspecified,FALSE,FALSE,,,,,,,S28901891,,,,,,Myiarchus crinitus,grcfly,Species,17334,,2.5,2,,,